author_name,author_profile_link,title,url
Ashley Carman,https://www.theverge.com/authors/ashley-carman,Peloton Bike Plus: an upgrade at a crucial time,https://www.theverge.com/22238974/peloton-bike-plus-review-price-features
Alice Jovanée,https://www.theverge.com/authors/alice-newcome-beill,How to preorder new AirPods Pro,https://www.theverge.com/23323757/apple-airpods-pro-new-second-gen-preorder-buy-price-release-date
Emma Roth,https://www.theverge.com/authors/emma-roth,Apple’s iPhone 14 event: the 9 biggest announcements,https://www.theverge.com/23341046/apple-iphone-14-plus-pro-max-notch-event-announcements-watch-8-se-ultra-airpods-pro
Victoria Song,https://www.theverge.com/authors/victoria-song,Hydrow Wave review: I can’t believe I love rowing now,https://www.theverge.com/23172559/hydrow-wave-review-rower-price-specs
Dan Seifert,https://www.theverge.com/authors/dan-seifert,Apple Watch SE review: pay a lot less to give up only a little,https://www.theverge.com/21496928/apple-watch-se-review-smartwatch-wearos-price-specs-features
Allison Johnson,https://www.theverge.com/authors/allison-johnson,Hands-on with the iPhone 14 and iPhone 14 Plus,https://www.theverge.com/23333525/iphone-14-plus-hands-on-features-apple-event
Victoria Song,https://www.theverge.com/authors/victoria-song,Peloton Row hands-on: pretty much what you’d expect,https://www.theverge.com/23361782/peloton-row-hands-on-rower-connected-fitness
Allison Johnson,https://www.theverge.com/authors/allison-johnson,OnePlus Nord N200 5G review: T-Mobile’s best phone under $250,https://www.theverge.com/22547482/oneplus-nord-n200-5g-review-screen-price-specs
Dieter Bohn,https://www.theverge.com/authors/dieter-bohn,"iPhone 13 Pro review: a better display, the best camera, and incredible battery life",https://www.theverge.com/22684033/apple-iphone-13-pro-max-review
Cameron Faulkner,https://www.theverge.com/authors/cameron-faulkner,How the iPhone 14 compares to the best Android phones of 2022,https://www.theverge.com/23320596/iphone-14-vs-android-apple-pro-comparison-price-specs
Allison Johnson,https://www.theverge.com/authors/allison-johnson,OnePlus 10T review: call it a comeback,https://www.theverge.com/23289302/oneplus-10t-review-specs-price-screen-fast-charging-camera
Tom Warren,https://www.theverge.com/authors/tom-warren,Hands-on with the iPhone 14 Pro and iPhone 14 Pro Max,https://www.theverge.com/23338833/iphone-14-pro-max-hands-on-notch-features-apple-event
Antonio G. Di Benedetto,https://www.theverge.com/authors/antonio-g-di-benedetto,"How to preorder the Apple Watch Series 8, Watch Ultra, and Watch SE",https://www.theverge.com/23322152/apple-watch-series-8-ultra-se-preorder-buy-price-release-date
Cameron Faulkner,https://www.theverge.com/authors/cameron-faulkner,"The iPhone 14 Pro’s always-on display, explained",https://www.theverge.com/23320405/apple-iphone-14-pro-max-always-on-display-screen-feature
Antonio G. Di Benedetto,https://www.theverge.com/authors/antonio-g-di-benedetto,Here’s how the new Apple Watches compare to each other on paper,https://www.theverge.com/23322044/apple-watch-series-7-vs-8-pro-se-comparison-price-specs
Jay Castello,https://www.theverge.com/authors/jay-castello,"Nostalgia is at the core of Pokémon, even as it moves into the future",https://www.theverge.com/23451417/pokemon-violet-scarlet-nostalgia
Umar Shakir,https://www.theverge.com/authors/umar-shakir,The iPhone turns 15: a visual history of every model to date,https://www.theverge.com/23316437/iphone-visual-history-apple-design-models
Cameron Faulkner,https://www.theverge.com/authors/cameron-faulkner,Logitech’s G Cloud Gaming Handheld is terminally online,https://www.theverge.com/23405040/logitech-g-cloud-gaming-handheld-review-game-streaming-android-xbox-nvidia-geforce-now
Charles Pulliam-Moore,https://www.theverge.com/authors/charles-pulliam-moore,"Pokémon Scarlet and Violet’s Paldea region is big, beautiful, and built for exploring",https://www.theverge.com/23415407/pokemon-scarlet-violet-hands-on-preview-nintendo-switch
Dan Seifert,https://www.theverge.com/authors/dan-seifert,An Apple Watch with Family Setup is an expensive smart watch for your kids,https://www.theverge.com/21518711/apple-watch-family-setup-test-review-features-explainer
Dieter Bohn,https://www.theverge.com/authors/dieter-bohn,Apple iPhone 12 review: raising the bar,https://www.theverge.com/21522988/iphone-12-review
Nilay Patel,https://www.theverge.com/authors/nilay-patel,Taylor Swift vs. Ronald Reagan: the Ticketmaster story,https://www.theverge.com/23645057/taylor-swift-ticketmaster-eras-tour-beyonce-antitrust-monopoly-reagan-senate-hearing-congress
Nilay Patel,https://www.theverge.com/authors/nilay-patel,"What is chokepoint capitalism, with authors Cory Doctorow and Rebecca Giblin",https://www.theverge.com/23547877/decoder-chokepoint-capitalism-cory-doctorow-rebecca-giblin-spotify-ticketmaster-antitrust
Nilay Patel,https://www.theverge.com/authors/nilay-patel,Apple iPhone 12 Pro Max review: the best smartphone camera you can get,https://www.theverge.com/21555901/iphone-12-pro-max-review
Nilay Patel,https://www.theverge.com/authors/nilay-patel,Never pay the ransom — a cybersecurity CEO explains why,https://www.theverge.com/23410990/cybersecurity-ransomware-healthcare-data-hipaa-hospitals
Dieter Bohn,https://www.theverge.com/authors/dieter-bohn,"OnePlus 9 Pro review: a refined, niche flagship",https://www.theverge.com/22344840/oneplus-9-pro-review-price-camera-screen-specs
Jasmine Hicks,https://www.theverge.com/authors/jasmine-hicks,How to turn on and use keyboard haptics in iOS 16,https://www.theverge.com/23203631/ios-16-keyboard-haptics-iphone-apple
Sean Hollister,https://www.theverge.com/authors/sean-hollister,"I wouldn’t trade my $400 Steam Deck for this $1,300 Ayaneo 2",https://www.theverge.com/23604799/ayaneo-2-review-handheld-gaming-pc
Jay Peters,https://www.theverge.com/authors/jay-peters,Apple Maps turns 10 — and it’s finally worth using,https://www.theverge.com/23323550/apple-maps-10-year-anniversary-iphone-google
Sean Hollister,https://www.theverge.com/authors/sean-hollister,Asus ROG Ally updated review: it’s a bit better now,https://www.theverge.com/23719210/asus-rog-ally-review
Victoria Song,https://www.theverge.com/authors/victoria-song,"Google Pixel Watch 2 review: better battery, better watch",https://www.theverge.com/23910570/google-pixel-watch-2-review-fitbit-safety-check-battery-stress-tracking
Nilay Patel,https://www.theverge.com/authors/nilay-patel,"‘The Goliath is Amazon’: after 100 years, Barnes & Noble wants to go back to its indie roots",https://www.theverge.com/23642104/barnes-and-noble-amazon-bookshop-ecommerce-decoder-podcast
Sheena Vasani,https://www.theverge.com/authors/sheena-vasani,Here’s where you can preorder Google’s new Pixel Watch 3,https://www.theverge.com/24215675/google-pixel-watch-3-preorder-how-to-buy-price-release-date
Nilay Patel,https://www.theverge.com/authors/nilay-patel,"How arson led to a culture reboot at Traeger, with CEO Jeremy Andrus",https://www.theverge.com/23189676/traeger-smart-grills-decoder-company-culture-private-equity-ceo-andrus
Dieter Bohn,https://www.theverge.com/authors/dieter-bohn,Apple iPhone 12 mini review: fit to size,https://www.theverge.com/21555295/iphone-12-mini-review
Stefan Etienne,https://www.theverge.com/authors/stefan-etienne,How to play Steam games in any room of your house,https://www.theverge.com/22962051/steam-games-remote-play-windows-ios-android-macos-streaming
Victoria Song,https://www.theverge.com/authors/victoria-song,Google won’t repair cracked Pixel Watch screens,https://www.theverge.com/23874281/google-pixel-watch-cracks-no-repairs-warranty
Sean Hollister,https://www.theverge.com/authors/sean-hollister,"Google’s head of Pixel 9 design won’t apologize for its big, beautiful camera bump",https://www.theverge.com/24220359/google-pixel-9-camera-bar-small-phones-claude-zellweger-interview
Victoria Song,https://www.theverge.com/authors/victoria-song,All the Pixel Watch 2 really needs is good battery life,https://www.theverge.com/23836353/pixel-watch-2-battery-life-wear-os-4
Monica Chin,https://www.theverge.com/authors/monica-chin,Asus ROG Ally hands-on: Windows but tiny,https://www.theverge.com/23695254/asus-rog-ally-handheld-gaming-pc-hands-on-preview
Sean Captain,https://www.theverge.com/authors/sean-captain,"How to rescue your hacked account: Facebook, Instagram, Snapchat, and more",https://www.theverge.com/23393036/hacked-account-facebook-instagram-snapchat-spotify-tiktok-twitter-reset-recovery
Alice Jovanée,https://www.theverge.com/authors/alice-newcome-beill,How to get your Steam Deck to access the Epic Games Store and more,https://www.theverge.com/23132688/steam-deck-epic-games-store-gog-origin-how-to
Barbara Krasnoff,https://www.theverge.com/authors/barbara-krasnoff,How to use multi-stop routing in iOS 16 using Apple Maps,https://www.theverge.com/23200139/apple-maps-ios-16-multi-stop-directions-how-to
Shubham Agarwal,https://www.theverge.com/authors/shubham-agarwal,The black market for blue checks,https://www.theverge.com/23379133/twitter-instagram-verified-account-for-sale-scam-criminal
Nilay Patel,https://www.theverge.com/authors/nilay-patel,How Blackstone became the darling of grill TikTok,https://www.theverge.com/22583787/blackstone-griddle-roger-dahle-interview-decoder
Sean Hollister,https://www.theverge.com/authors/sean-hollister,Hands-on: Nvidia’s GeForce Now just leapfrogged Google Stadia,https://www.theverge.com/22750246/nvidia-geforce-now-rtx-3080-google-stadia-cloud-gaming
Sam Byford,https://www.theverge.com/authors/sam-byford,Aya Neo Next review: a Steam Deck alternative with Windows,https://www.theverge.com/22972334/aya-neo-next-review-vs-steam-deck-windows
Dieter Bohn,https://www.theverge.com/authors/dieter-bohn,Apple iPad Air (2020) review: take it from the Pro,https://www.theverge.com/21525780/apple-ipad-air-2020-review
Sean Hollister,https://www.theverge.com/authors/sean-hollister,"The Steam Deck wasn’t born ready, but it’s ready now",https://www.theverge.com/23513517/steam-deck-long-term-test-valve
Allison Johnson,https://www.theverge.com/authors/allison-johnson,Kyocera DuraForce Ultra 5G UW review: extreme durability for an extreme price,https://www.theverge.com/22446490/kyocera-duraforce-ultra-5g-uw-review-price-specs-screen-camera
Verge Staff,https://www.theverge.com/authors/verge-staff,Switch 2: all the news and rumors on Nintendo’s next console,https://www.theverge.com/24051677/nintendo-switch-2-pro-rumors-news
Sean Hollister,https://www.theverge.com/authors/sean-hollister,The Epic question: how Google lost when Apple won,https://www.theverge.com/24003500/epic-v-google-loss-apple-win-fortnite-trial-monopoly
Dieter Bohn,https://www.theverge.com/authors/dieter-bohn,Fossil Gen 6 smartwatch review: better luck next time,https://www.theverge.com/22764448/fossil-gen-6-smartwatch-review
Sean Hollister,https://www.theverge.com/authors/sean-hollister,Call of Duty now lets you destroy cheaters with your own automatic god mode,https://www.theverge.com/22941414/call-of-duty-warzone-ricochet-anti-cheat-damage-shield-troll
Sean Hollister,https://www.theverge.com/authors/sean-hollister,Valve answers our burning Steam Deck questions — including a possible Steam Controller 2,https://www.theverge.com/23499215/valve-steam-deck-interview-late-2022
Verge Staff,https://www.theverge.com/authors/verge-staff,"Steam Deck, ROG Ally, and more: all the news about the handheld PC gaming revolution",https://www.theverge.com/22579493/valve-steam-deck-gaming-handheld-pc
Sean Hollister,https://www.theverge.com/authors/sean-hollister,"Steam Deck, one month later",https://www.theverge.com/22960536/steam-deck-faq-valve-one-month-later
Verge Staff,https://www.theverge.com/authors/verge-staff,Nintendo Switch 2 announcement: all the news on the next console,https://www.theverge.com/24284512/nintendo-switch-2-direct-news-trailers-games-features
Andrew Webster,https://www.theverge.com/authors/andrew-webster,The Switch 2 is boring — and that’s exactly what Nintendo needs,https://www.theverge.com/24344511/nintendo-switch-2-features-specs-handheld-dock-upgrade-comparison
Barbara Krasnoff,https://www.theverge.com/authors/barbara-krasnoff,How to increase your personal safety with Pixel and Samsung phones,https://www.theverge.com/23353773/android-pixel-samsung-personal-safety-how-to
Tom Warren,https://www.theverge.com/authors/tom-warren,Xbox Cloud Gaming now supports Steam Deck through Microsoft Edge,https://www.theverge.com/22985166/xbox-cloud-gaming-steam-deck-microsoft-edge-beta
Sean Hollister,https://www.theverge.com/authors/sean-hollister,"Valve reveals the Steam Deck OLED: $549 buys better screen, battery, and more",https://www.theverge.com/23951674/valve-steam-deck-oled-price-release-date
Sean Hollister,https://www.theverge.com/authors/sean-hollister,Steam Deck: Five big things we learned from Valve’s developer summit,https://www.theverge.com/22779252/steam-deck-things-we-learned-from-valve-developer-summit
Dan Seifert,https://www.theverge.com/authors/dan-seifert,An update on review scoring,https://www.theverge.com/23286429/review-score-update-processes
Sam Byford,https://www.theverge.com/authors/sam-byford,Lost Judgment is a better sequel with a messy story,https://www.theverge.com/22708841/lost-judgment-review-ps5-xbox
Barbara Krasnoff,https://www.theverge.com/authors/barbara-krasnoff,How to password-protect your PDFs,https://www.theverge.com/23339732/pdf-password-protect-mac-apple-windows-how-to
Sean Hollister,https://www.theverge.com/authors/sean-hollister,Epic win: Jury decides Google has illegal monopoly in app store fight,https://www.theverge.com/23994174/epic-google-trial-jury-verdict-monopoly-google-play?showComments=1
Sean Hollister,https://www.theverge.com/authors/sean-hollister,Lenovo Legion Go review: the Swiss Army knife of handhelds,https://www.theverge.com/24088011/lenovo-legion-go-review
Mitchell Clark,https://www.theverge.com/authors/mitchell-clark,How to reset your Apple ID password,https://www.theverge.com/23355850/apple-id-password-reset-forgot-iphone-ipad-device
Sean Hollister,https://www.theverge.com/authors/sean-hollister,Valve says you shouldn’t fix the Steam Deck’s noisy fan this way,https://www.theverge.com/23047412/valve-steam-deck-fan-tape-fix-noise-whine
Andrew Webster,https://www.theverge.com/authors/andrew-webster,Nintendo’s big year is about more than games,https://www.theverge.com/23718273/nintendo-2023-big-moment-mario-zelda
Sean Hollister,https://www.theverge.com/authors/sean-hollister,The MSI Claw is an embarrassment,https://www.theverge.com/24105991/msi-claw-review
Jon Porter,https://www.theverge.com/authors/jon-porter,The best free password manager,https://www.theverge.com/22311182/best-free-password-manager-bitwarden-zoho-vault-roboform-sticky-password
Dieter Bohn,https://www.theverge.com/authors/dieter-bohn,Android 12 preview: first look at Google’s radical new design,https://www.theverge.com/22439777/android-12-design-features-widgets-first-look-google
Sean Hollister,https://www.theverge.com/authors/sean-hollister,"Bungie rejects Steam Deck’s Linux, threatens to ban Destiny 2 players there",https://www.theverge.com/22957294/bungie-destiny-2-steam-deck-game-ban
Cameron Faulkner,https://www.theverge.com/authors/cameron-faulkner,How to use your own controllers to play Google Stadia,https://www.theverge.com/22982878/google-stadia-controller-how-to-pair-bluetooth-ps4-ps5-xbox
Nilay Patel,https://www.theverge.com/authors/nilay-patel,Microsoft CEO Satya Nadella on the business of Windows,https://www.theverge.com/22549385/microsoft-satya-nadella-interview-windows-11-decoder
Antonio G. Di Benedetto,https://www.theverge.com/authors/antonio-g-di-benedetto,How Google’s new Pixel 9 phones differ from one another (and don’t),https://www.theverge.com/24216079/google-pixel-9-pro-xl-fold-comparison-specs-price-features
Barbara Krasnoff,https://www.theverge.com/authors/barbara-krasnoff,How to set up two-factor authentication on your online services,https://www.theverge.com/23612381/two-factor-authentication-2fa-amazon-twitter-how-to
Andrew Webster,https://www.theverge.com/authors/andrew-webster,Ratchet & Clank: Rift Apart is next-gen Uncharted by way of Pixar,https://www.theverge.com/22523093/ratchet-clank-rift-apart-review-ps5
Andrew Webster,https://www.theverge.com/authors/andrew-webster,Pokémon Legends: Arceus breathes new life into Pokémon,https://www.theverge.com/22898939/pokemon-legends-arceus-review-nintendo-switch
Andrew Webster,https://www.theverge.com/authors/andrew-webster,Pokémon Violet and Scarlet’s first expansion is coming later this year,https://www.theverge.com/23616694/pokemon-violet-and-scarlet-dlc-expansion-trailer-nintendo-switch
Cameron Faulkner,https://www.theverge.com/authors/cameron-faulkner,How to enable cross-save with your Destiny 2 data,https://www.theverge.com/22966324/destiny-2-how-to-cross-save-game-pc-xbox-ps4-steam-data
Emma Roth,https://www.theverge.com/authors/emma-roth,Everything Google announced at the Pixel 9 launch event,https://www.theverge.com/24218825/google-pixel-9-event-announcements-products
Andrew Webster,https://www.theverge.com/authors/andrew-webster,A nerdy PS5 chat with Ratchet & Clank: Rift Apart’s tech director,https://www.theverge.com/22431256/ratchet-and-clank-rift-apart-ps5-interiew-tech-ray-tracing-ssd
Tom Warren,https://www.theverge.com/authors/tom-warren,A closer look at the Xbox Series X controller and 1TB expansion cards,https://www.theverge.com/21452750/microsoft-xbox-series-x-controller-1tb-expansion-cards-hands-on
Emma Roth,https://www.theverge.com/authors/emma-roth,Here’s how to secure your Twitter account without paying for Blue,https://www.theverge.com/23606430/how-to-secure-twitter-account-2fa-without-blue
Chaim Gartenberg,https://www.theverge.com/authors/chaim-gartenberg,The N64 controller was a weird but essential introduction to joysticks,https://www.theverge.com/22643372/nintendo-64-controller-joystick-button-3d-gaming-control
Allison Johnson,https://www.theverge.com/authors/allison-johnson,Pixel 8 and 8 Pro review: in Google we trust?,https://www.theverge.com/23912370/google-pixel-8-pro-review-camera-assistant-magic-editor-best-take-audio-eraser
Jay Peters,https://www.theverge.com/authors/jay-peters,"Sony is buying Bungie, the developer of Destiny and original creator of Halo",https://www.theverge.com/22910846/sony-bungie-acquisition-playstation-destiny-halo
Jay Peters,https://www.theverge.com/authors/jay-peters,How to connect your Xbox controller to a PC or phone and swap back to your console,https://www.theverge.com/22273528/how-to-xbox-series-x-controller-swap-connection-phone-pc
Sean Hollister,https://www.theverge.com/authors/sean-hollister,We asked LG for a burn-in warranty on its OLED monitor — and it’s delivering,https://www.theverge.com/23827701/lg-oled-burn-in-warranty-two-desktop-monitor-windows
Barbara Krasnoff,https://www.theverge.com/authors/barbara-krasnoff,Seven free alternatives to the LastPass password manager,https://www.theverge.com/22285499/password-manager-lastpass-free-bitwarden-zoho
Nilay Patel,https://www.theverge.com/authors/nilay-patel,Why Spotify’s Horacio Gutierrez thinks Apple behaves like a monopolist,https://www.theverge.com/22457400/spotify-horacio-gutierrez-apple-app-store-interview-decoder
Sam Byford,https://www.theverge.com/authors/sam-byford,Super Nintendo World is sensory overload,https://www.theverge.com/22339582/super-nintendo-world-review-theme-park-japan
Barbara Krasnoff,https://www.theverge.com/authors/barbara-krasnoff,How to use the iOS app tracking blocker,https://www.theverge.com/22403523/ios-14-5-tracking-consent-app-transparency-how-to
Verge Staff,https://www.theverge.com/authors/verge-staff,"Google I/O 2021: rumors, news, and announcements",https://www.theverge.com/22432922/google-io-2021-rumors-news-announcements
Barbara Krasnoff,https://www.theverge.com/authors/barbara-krasnoff,How to (hopefully) restore your Gmail account if you lose access,https://www.theverge.com/22601959/gmail-google-password-restore-blocked-account
Andrew Webster,https://www.theverge.com/authors/andrew-webster,Nintendo’s Alarmo is cute and cozy — but it’s still just an alarm clock,https://www.theverge.com/24273422/nintendo-alarmo-review-alarm-clock
Julia Alexander,https://www.theverge.com/authors/julia-alexander,Why Peacock and HBO Max aren’t on the biggest streaming platforms,https://www.theverge.com/21324139/peacock-roku-amazon-fire-tv-hbo-max-streaming-warnermedia-nbcuniversal-disney-apple
Nicole Froio,https://www.theverge.com/authors/nicole-froio,The cruel temptation of the job offer scam,https://www.theverge.com/23376976/job-offer-scam-linkedin-bad-check-security-suspicion
Jay Peters,https://www.theverge.com/authors/jay-peters,Nintendo shares the first gameplay trailer for Metroid Prime 4: Beyond,https://www.theverge.com/23768041/metroid-prime-4-nintendo-direct-trailer
Cameron Faulkner,https://www.theverge.com/authors/cameron-faulkner,"Canceling your Stadia Pro subscription is easy, and you won’t lose your paid games",https://www.theverge.com/22989091/google-stadia-pro-subscription-free-trial-how-to-cancel-paid-games
Sean Hollister,https://www.theverge.com/authors/sean-hollister,"So long, small phones",https://www.theverge.com/23913658/best-small-phone-dead-iphone-mini-z-flip-pixel-8
David Strom,https://www.theverge.com/authors/david-strom,How to recover when your Facebook account is hacked,https://www.theverge.com/22785819/facebook-hacked-security-privacy-recover
Julia Alexander,https://www.theverge.com/authors/julia-alexander,Peacock’s not-so-secret ingredient in the streaming wars is its free tier,https://www.theverge.com/21320100/peacock-launch-free-paid-cost-tv-shows-originals-movies-sports-news
Mitchell Clark,https://www.theverge.com/authors/mitchell-clark,Why I’m using a keyboard phone in 2023,https://www.theverge.com/23673548/keyboard-phone-2023-features-unihertz-titan-pocket
Sean Hollister,https://www.theverge.com/authors/sean-hollister,Google’s seven-year Pixel update promise is historic — or meaningless,https://www.theverge.com/23904092/google-pixel-update-seven-years-editorial
Charles Pulliam-Moore,https://www.theverge.com/authors/charles-pulliam-moore,Zelda is finally getting her own game,https://www.theverge.com/24180615/legend-of-zelda-echoes-of-wisdom-trailer-nintendo-direct
Alexis Ong,https://www.theverge.com/authors/alexis-ong,"Pokémon Sleep helped me catch ’em all — all the z’s, that is",https://www.theverge.com/23893260/pokemon-sleep-insomnia-app-nintendo-aid
Nathan Edwards,https://www.theverge.com/authors/nathan-edwards,The best phone deals of Prime Big Deal Days,https://www.theverge.com/23910382/amazon-october-prime-day-best-phone-deals-2023
Allison Johnson,https://www.theverge.com/authors/allison-johnson,Samsung Galaxy Z Flip 5 review: the flip phone we’ve been waiting for,https://www.theverge.com/23820202/samsung-galaxy-z-flip-5-review-screen-battery-camera-hinge
Barbara Krasnoff,https://www.theverge.com/authors/barbara-krasnoff,How to back up your Google account,https://www.theverge.com/21324801/gmail-download-data-back-up-save-email
Sean Hollister,https://www.theverge.com/authors/sean-hollister,The Indiglo button let there be light,https://www.theverge.com/24051162/indiglo-button-of-the-month
Jon Porter,https://www.theverge.com/authors/jon-porter,"8BitDo’s NES buttons are a big, red, Nintendo-themed invitation to experiment",https://www.theverge.com/23934698/8bitdo-nes-keyboard-experiment-button-of-the-month
Chaim Gartenberg,https://www.theverge.com/authors/chaim-gartenberg,There are more streaming choices than ever — why are prices going up?,https://www.theverge.com/21310442/tv-streaming-youtube-fubo-price-increases-carrier-fees-disputes-costs-cable-television
Nathan Edwards,https://www.theverge.com/authors/nathan-edwards,What’s up with the temperature sensor on the Pixel 8 Pro?,https://www.theverge.com/23903842/pixel-8-pro-temperature-sensor-fda-feature
Allison Johnson,https://www.theverge.com/authors/allison-johnson,Samsung S23 and S23 Plus review: say ‘yes’ to the S,https://www.theverge.com/23610777/samsung-galaxy-s23-plus-review-camera-battery-screen-specs
Sean Hollister,https://www.theverge.com/authors/sean-hollister,LG’s 27-inch OLED is ushering in a new age for monitors,https://www.theverge.com/22336413/lg-27gr95qe-b-oled-gaming-monitor-review
Sean Hollister,https://www.theverge.com/authors/sean-hollister,The T-Mobile Sidekick’s Jump button made mobile multitasking easy,https://www.theverge.com/24115039/danger-hiptop-t-mobile-sidekick-jump-button
Allison Johnson,https://www.theverge.com/authors/allison-johnson,The Pixel 9 Pro XL showed me the future of AI photography,https://www.theverge.com/24219032/pixel-9-pro-xl-hands-on-camera-ai-features-specs-price
Stefan Etienne,https://www.theverge.com/authors/stefan-etienne,How to use a two-factor security key,https://www.theverge.com/22458935/two-factor-security-key-how-to-yubico
Sean Hollister,https://www.theverge.com/authors/sean-hollister,Epic CEO Tim Sweeney: the post-trial interview,https://www.theverge.com/23996474/epic-tim-sweeney-interview-win-google-antitrust-lawsuit-district-court
Cameron Faulkner,https://www.theverge.com/authors/cameron-faulkner,How to get a refund from the PlayStation Store,https://www.theverge.com/23005156/playstation-store-refund-how-to-sony
Victoria Song,https://www.theverge.com/authors/victoria-song,Peloton Guide review: a webcam that watches you squat,https://www.theverge.com/23009893/peloton-guide-review-fitness
Andrew Webster,https://www.theverge.com/authors/andrew-webster,Splatoon remains the most playful and stylish shooter around in third outing,https://www.theverge.com/23339801/splatoon-3-review-nintendo-switch
