author_name,author_profile_link,title,url
Victoria Song,https://www.theverge.com/authors/victoria-song,The best fitness trackers to buy right now,https://www.theverge.com/22985108/best-fitness-tracker
David Pierce,https://www.theverge.com/authors/david-pierce,The best iPad to buy,https://www.theverge.com/23639378/best-ipad-apple-buy-model-price
Victoria Song,https://www.theverge.com/authors/victoria-song,The best sleep gadgets to help you catch those Zzzs,https://www.theverge.com/23291925/best-sleep-tech-trackers-earbuds-wearables
Sheena Vasani,https://www.theverge.com/authors/sheena-vasani,Here are the best AirPods deals you can get right now,https://www.theverge.com/21302051/best-apple-airpods-deals
Sheena Vasani,https://www.theverge.com/authors/sheena-vasani,The best ebook reader to buy right now,https://www.theverge.com/23769068/best-ebook-readers
Victoria Song,https://www.theverge.com/authors/victoria-song,The best smartwatches for Android,https://www.theverge.com/23449363/best-android-smartwatches-wear-os
Allison Johnson,https://www.theverge.com/authors/allison-johnson,The best phone to buy right now,https://www.theverge.com/22163811/best-phone
Chris Welch,https://www.theverge.com/authors/chris-welch,The best wireless earbuds to buy right now,https://www.theverge.com/21309820/best-wireless-earbuds
Quentyn Kennemer,https://www.theverge.com/authors/quentyn-kennemer,The DJI Pocket 3 is almost everything I wanted my iPhone camera to be,https://www.theverge.com/24152949/dji-osmo-pocket-3-opinion
Jennifer Pattison Tuohy,https://www.theverge.com/authors/jennifer-tuohy,The best robot vacuums,https://www.theverge.com/22997597/best-robot-vacuum-cleaner
Sheena Vasani,https://www.theverge.com/authors/sheena-vasani,The best instant cameras you can buy right now,https://www.theverge.com/23133103/best-instant-cameras-fujifilm-polaroid-kodak
Wes Davis,https://www.theverge.com/authors/wes-davis,In defense of the iPhone Action Button,https://www.theverge.com/24246068/apple-iphone-16-pro-action-button-ios-shortcuts-uses-examples
Allison Johnson,https://www.theverge.com/authors/allison-johnson,Apple iPhone 16 and 16 Plus review: all caught up,https://www.theverge.com/24247479/apple-iphone-16-plus-review-camera-control-screen-battery
Dan Seifert,https://www.theverge.com/authors/dan-seifert,"OnePlus Watch review: big, basic, and boring",https://www.theverge.com/22380322/oneplus-watch-review-price-specs-features
Victoria Song,https://www.theverge.com/authors/victoria-song,Apple Watch Series 8 review: if it ain’t broke,https://www.theverge.com/23353756/apple-watch-series-8-review-smartwatch-wearables
Chris Welch,https://www.theverge.com/authors/chris-welch,Bose QuietComfort Ultra Earbuds review: still great but a questionable ‘upgrade’,https://www.theverge.com/23883649/bose-quietcomfort-ultra-earbuds-review
Chris Welch,https://www.theverge.com/authors/chris-welch,"Apple AirPods Pro (second-gen) review: same look, better everything else",https://www.theverge.com/23365910/apple-airpods-pro-second-generation-review
Jennifer Pattison Tuohy,https://www.theverge.com/authors/jennifer-tuohy,Battle of the best robovacs (that iRobot doesn’t make),https://www.theverge.com/24141479/roborock-s8-maxv-ultra-vs-dreame-x30-ultra-robot-vacuum-mop
Jennifer Pattison Tuohy,https://www.theverge.com/authors/jennifer-tuohy,Roborock S7 MaxV Ultra review: this bot cleans its own bottom,https://www.theverge.com/22960447/roborock-s7-maxv-ultra-review-robot-vacuum-mop-hybrid
Quentyn Kennemer,https://www.theverge.com/authors/quentyn-kennemer,Here are the best robot vacuum deals right now,https://www.theverge.com/24350561/best-robot-vacuum-mop-irobot-roomba-eufy-roborock-deals-sale
Chris Welch,https://www.theverge.com/authors/chris-welch,Bose QuietComfort Earbuds II review: noise cancellation domination,https://www.theverge.com/23353777/bose-quietcomfort-earbuds-2-review
Victoria Song,https://www.theverge.com/authors/victoria-song,How to use wearable tech if you’ve got tattoos,https://www.theverge.com/23567992/wearable-tech-tattoos-fitness-tracking-how-to
Victoria Song,https://www.theverge.com/authors/victoria-song,Oura Ring Generation 3 review: a relationship for the long term,https://www.theverge.com/22789248/oura-ring-3-review-sleep-tracker-fitness-tracker
Becca Farsace,https://www.theverge.com/authors/becca-farsace,Fujifilm’s new Instax Square SQ1 brings the instant camera back to its basics,https://www.theverge.com/21431103/fujifilm-instax-square-sq1-instant-camera-review-price-specs-features
Jennifer Pattison Tuohy,https://www.theverge.com/authors/jennifer-tuohy,The best doorbell cameras,https://www.theverge.com/22954554/best-video-doorbell-camera
Chris Welch,https://www.theverge.com/authors/chris-welch,Sony WF-1000XM5 noise-canceling earbuds review: better in every way — for now,https://www.theverge.com/23803374/sony-wf-1000xm5-earbuds-review
Jennifer Pattison Tuohy,https://www.theverge.com/authors/jennifer-tuohy,The best budget robot vacuums,https://www.theverge.com/23846479/best-budget-robot-vacuum-robot-mop
Allison Johnson,https://www.theverge.com/authors/allison-johnson,Nothing Phone 2 review: the vibes abide,https://www.theverge.com/23792961/nothing-phone-2-review-glyph-screen-battery-camera
Jennifer Pattison Tuohy,https://www.theverge.com/authors/jennifer-tuohy,How to control your robot vacuum with Google Assistant,https://www.theverge.com/22968709/robot-vacuum-connect-google-assistant-roomba-roborock-how-to
Jennifer Pattison Tuohy,https://www.theverge.com/authors/jennifer-tuohy,"What Matters about Matter, the new smart home standard",https://www.theverge.com/22832127/matter-smart-home-products-thread-wifi-explainer
Allison Johnson,https://www.theverge.com/authors/allison-johnson,The Samsung Galaxy Z Fold 6 is a great phone that’s out of ideas,https://www.theverge.com/24204714/samsung-galaxy-z-fold-6-review-screen-battery-camera
Chris Welch,https://www.theverge.com/authors/chris-welch,The LinkBuds are Sony’s strangest earbuds in years — and surprisingly good,https://www.theverge.com/22933521/sony-linkbuds-earbuds-review-features-specs
Thomas Ricker,https://www.theverge.com/authors/thomas-ricker,Anker’s latest Soundcore Sleep earbuds actually improve slumber,https://www.theverge.com/24125032/soundcore-sleep-a20-review-noise-cancelling-earbuds
Allison Johnson,https://www.theverge.com/authors/allison-johnson,Samsung Galaxy Z Flip 6 review: the practical flip phone,https://www.theverge.com/24211507/samsung-galaxy-z-flip-6-review-screen-battery-camera
Allison Johnson,https://www.theverge.com/authors/allison-johnson,Google Pixel Fold review: closing the gap,https://www.theverge.com/23773594/google-pixel-fold-review-screen-battery-hinge-camera
Megan Wollerton,https://www.theverge.com/authors/megan-wollerton,How to start a smart home using Google Home,https://www.theverge.com/23744291/google-smart-home-nest-how-to
Allison Johnson,https://www.theverge.com/authors/allison-johnson,Pocket City 2 is a mobile SimCity but better,https://www.theverge.com/23691395/pocket-city-2-game-ios-android
Verge Staff,https://www.theverge.com/authors/verge-staff,"All the smart home news, reviews, and gadgets you need to know about",https://www.theverge.com/24190824/smart-home-news-reviews-guides-gadgets
Allison Johnson,https://www.theverge.com/authors/allison-johnson,Apple iPhone 14 review: meet the iPhone 13S,https://www.theverge.com/23352282/iphone-14-review-apple
Dieter Bohn,https://www.theverge.com/authors/dieter-bohn,Galaxy Watch 4 review: welcome to Samsung’s garden,https://www.theverge.com/22629459/galaxy-watch-4-classic-review-bixby-google-wearos
Nilay Patel,https://www.theverge.com/authors/nilay-patel,Apple iPhone 14 Pro review: early adopter island,https://www.theverge.com/23351948/apple-iphone-14-pro-review
Allison Johnson,https://www.theverge.com/authors/allison-johnson,Motorola Razr Plus review: the right moves,https://www.theverge.com/23768630/motorola-razr-plus-40-ultra-review-screen-battery-camera
Victoria Song,https://www.theverge.com/authors/victoria-song,How to set up medication reminders in iOS 16,https://www.theverge.com/23206983/medication-reminders-ios-16-public-beta-how-to
Dan Seifert,https://www.theverge.com/authors/dan-seifert,The Pixel Fold shows how far ahead Samsung’s folding phones are,https://www.theverge.com/23773112/google-pixel-fold-vs-samsung-z-fold-4-comparison-head-to-head-foldable-phones
Allison Johnson,https://www.theverge.com/authors/allison-johnson,The best Android phones,https://www.theverge.com/23674658/best-android-phone
Chris Welch,https://www.theverge.com/authors/chris-welch,"Apple AirPods (third-gen) review: new design, same appeal",https://www.theverge.com/22744686/apple-airpods-third-gen-review
Allison Johnson,https://www.theverge.com/authors/allison-johnson,Samsung Galaxy S24 and S24 Plus review: smart choices,https://www.theverge.com/24058916/samsung-galaxy-s24-plus-review-screen-battery-camera
Allison Johnson,https://www.theverge.com/authors/allison-johnson,Google Pixel 7 and Pixel 7 Pro review: better and better,https://www.theverge.com/23399315/google-pixel-7-pro-review-screen-camera-battery-price
Chris Welch,https://www.theverge.com/authors/chris-welch,"Apple TV 4K (2021) review: much better remote, slightly faster box",https://www.theverge.com/22454960/apple-tv-4k-2021-review
Thomas Ricker,https://www.theverge.com/authors/thomas-ricker,Ikea overhauls its smart home with new Matter-ready hub and app,https://www.theverge.com/23139703/ikea-dirigera-home-smart-hub-app-price-date-specs
Sean Hollister,https://www.theverge.com/authors/sean-hollister,"With official Matter support, Eero mesh routers could soon run your smart home",https://www.theverge.com/22741839/eero-ceo-confirms-matter-support-thread
Jennifer Pattison Tuohy,https://www.theverge.com/authors/jennifer-tuohy,Nest Learning Thermostat review: pretty smart,https://www.theverge.com/24322643/nest-learning-thermostat-4th-gen-review
Chris Person,https://www.theverge.com/authors/chris-person,How to keep your smart cam footage safe and private,https://www.theverge.com/24074904/smart-home-camera-security-privacy-how-to
Jennifer Pattison Tuohy,https://www.theverge.com/authors/jennifer-tuohy,Lockly Vision Elite review: two become one,https://www.theverge.com/23345083/lockly-vision-elite-review-smart-door-lock-video-doorbell
Jennifer Pattison Tuohy,https://www.theverge.com/authors/jennifer-tuohy,Why Matter mattered at CES,https://www.theverge.com/23547154/matter-smart-home-new-devices-ces-2023
Allison Johnson,https://www.theverge.com/authors/allison-johnson,Sony’s Xperia 1 IV is a pricey proof of concept,https://www.theverge.com/23065641/sony-xperia-1-iv-announcement-hands-on-price-specs-zoom-screen
Jennifer Pattison Tuohy,https://www.theverge.com/authors/jennifer-tuohy,How to install a Ring video doorbell,https://www.theverge.com/23157868/how-to-install-ring-video-doorbell-wired-wireless
Jennifer Pattison Tuohy,https://www.theverge.com/authors/jennifer-tuohy,SwitchBot Lock review: a tiny robot hand that unlocks your door,https://www.theverge.com/23323597/switchbot-lock-review-smart-door-lock
Jennifer Pattison Tuohy,https://www.theverge.com/authors/jennifer-tuohy,"My smart kitchen: the good, the bad, and the future",https://www.theverge.com/24087703/smart-home-kitchen-appliances
Jennifer Pattison Tuohy,https://www.theverge.com/authors/jennifer-tuohy,Yale Assure Lock 2 review: almost perfect,https://www.theverge.com/23367464/yale-assure-lock-2-touchscreen-keypad-wifi-review
Allison Johnson,https://www.theverge.com/authors/allison-johnson,"OnePlus 13 review: finally, a flagship that can hang",https://www.theverge.com/24336534/oneplus-13-review-specs-screen-camera-battery
Jennifer Pattison Tuohy,https://www.theverge.com/authors/jennifer-tuohy,Smart home hubs: what they are and why you need one,https://www.theverge.com/24087882/smart-home-hub-apple-google-alexa
Jennifer Pattison Tuohy,https://www.theverge.com/authors/jennifer-tuohy,2023 in the smart home: Matter’s broken promises,https://www.theverge.com/23997548/matter-smart-home-2023-platforms
Jennifer Pattison Tuohy,https://www.theverge.com/authors/jennifer-tuohy,Matter will be better in 2025 — say the people who make it,https://www.theverge.com/24349390/matter-csa-thread-group-wifi-alliance-interview-2025
Andrew Liszewski,https://www.theverge.com/authors/andrew-liszewski,The Amazon Echo graveyard,https://www.theverge.com/24271840/amazon-alexa-echo-discontinued-smart-home-assistant
Verge Staff,https://www.theverge.com/authors/verge-staff,The Verge Awards at CES 2023,https://www.theverge.com/23542177/verge-awards-ces-2023-best-tv-laptop-smart-home-car-monitor
Jennifer Pattison Tuohy,https://www.theverge.com/authors/jennifer-tuohy,"Amazon Astro review: too much Alexa, not enough arms",https://www.theverge.com/23141966/amazon-astro-robot-review
Victoria Song,https://www.theverge.com/authors/victoria-song,The woes of a blundering first-time smart home owner,https://www.theverge.com/24062531/first-time-smart-home-nest-thermostat-govee
Pam Baker,https://www.theverge.com/authors/pam-baker,To worry or not to worry: answering questions about smart home security,https://www.theverge.com/23753752/smart-home-privacy-security-questions-explained
Jennifer Pattison Tuohy,https://www.theverge.com/authors/jennifer-tuohy,Matter: what you need to know,https://www.theverge.com/23390726/matter-smart-home-faq-questions-answers
Jennifer Pattison Tuohy,https://www.theverge.com/authors/jennifer-tuohy,Why Thread is Matter’s biggest problem right now,https://www.theverge.com/23820078/matters-biggest-problem-apple-google-thread-border-router-interoperability
Dan Seifert,https://www.theverge.com/authors/dan-seifert,Schlage’s latest smart lock makes unlocking your door as easy as using Apple Pay,https://www.theverge.com/22964521/schlage-smart-lock-review-encode-plus-apple-home-key-test
Jennifer Pattison Tuohy,https://www.theverge.com/authors/jennifer-tuohy,Matter’s plan to save the smart home,https://www.theverge.com/22787729/matter-smart-home-standard-apple-amazon-google
Chris Person,https://www.theverge.com/authors/chris-person,How to start a smart home using Home Assistant,https://www.theverge.com/23744526/smart-home-assistant-how-to-automation
Alex Cranz,https://www.theverge.com/authors/alex-cranz,Living with the ghost of a smart home’s past,https://www.theverge.com/24073300/smart-home-new-house-old-tech
Allison Johnson,https://www.theverge.com/authors/allison-johnson,Samsung’s Galaxy S22 and S22 Plus are the default Android phones to buy,https://www.theverge.com/22955139/samsung-galaxy-s22-plus-review
Chris Welch,https://www.theverge.com/authors/chris-welch,Jabra Elite 3 review: nailing the essentials for $80,https://www.theverge.com/22676362/jabra-elite-3-wireless-earbuds-review
Jennifer Pattison Tuohy,https://www.theverge.com/authors/jennifer-tuohy,Ecobee’s new thermostats are its best yet,https://www.theverge.com/23076845/ecobee-smart-thermostat-premium-enhanced-review
Wes Davis,https://www.theverge.com/authors/wes-davis,How to start a smart home using Apple Home,https://www.theverge.com/23751656/apple-home-smart-devices-gadgets-homepod-mini
Jennifer Pattison Tuohy,https://www.theverge.com/authors/jennifer-tuohy,How to connect your video doorbell to your smart display,https://www.theverge.com/22949565/doorbell-video-nest-echo-show-alexa-google-how-to
Jennifer Pattison Tuohy,https://www.theverge.com/authors/jennifer-tuohy,TP-Link’s new smart plug exposes a complicated Matter,https://www.theverge.com/23599437/tp-link-tapo-p125m-review-matter-apple-amazon-google-smartthings
Jennifer Pattison Tuohy,https://www.theverge.com/authors/jennifer-tuohy,Nanoleaf’s new Matter light bulbs are an essential part of the smart home,https://www.theverge.com/23706841/nanoleaf-essentials-matter-smart-bulbs-review
Jennifer Pattison Tuohy,https://www.theverge.com/authors/jennifer-tuohy,Amazon’s Smart Air Quality Monitor could be a lot smarter,https://www.theverge.com/22971411/amazon-smart-air-quality-monitor-iaq-review
Jennifer Pattison Tuohy,https://www.theverge.com/authors/jennifer-tuohy,"Nest Wifi Pro review: better, faster, shinier",https://www.theverge.com/23473181/google-nest-wifi-pro-review
Jennifer Pattison Tuohy,https://www.theverge.com/authors/jennifer-tuohy,The first Thread motion sensor adds much-needed reliability to the smart home,https://www.theverge.com/23291203/eve-motion-sensor-review-thread-homekit-matter
Steven Aquino,https://www.theverge.com/authors/steven-aquino,How smart home technology made my home more accessible,https://www.theverge.com/24080201/smart-home-accessibility-apple-nest-alexa
Nilay Patel,https://www.theverge.com/authors/nilay-patel,"How Amazon runs Alexa, with Dave Limp",https://www.theverge.com/22719945/amazon-alexa-dave-limp-interview-ambient-computing-ring-eero-decoder
Jennifer Pattison Tuohy,https://www.theverge.com/authors/jennifer-tuohy,The Echo Hub is Alexa’s missing piece,https://www.theverge.com/24078558/echo-hub-review-alexa-amazon-smart-control-panel
Allison Johnson,https://www.theverge.com/authors/allison-johnson,Samsung Galaxy A52 5G review: a midrange phone that will last,https://www.theverge.com/22399456/samsung-galaxy-a52-5g-review-camera-screen-specs-price
David Ludlow,https://www.theverge.com/authors/david-ludlow,How to start a smart home using Samsung SmartThings,https://www.theverge.com/23743633/samsung-smartthings-smart-home-how-to
Jennifer Pattison Tuohy,https://www.theverge.com/authors/jennifer-tuohy,Alexa Together review: keeping tabs on Dad,https://www.theverge.com/23066024/alexa-together-review-elder-care-urgent-response
Verge Staff,https://www.theverge.com/authors/verge-staff,It’s clearly time: all the news about the transparent tech renaissance,https://www.theverge.com/23774468/clear-transparent-tech-gadgets-news-announcements-products
Alex Cranz,https://www.theverge.com/authors/alex-cranz,The best shows on Apple TV Plus in 2023,https://www.theverge.com/24002720/best-apple-tv-plus-shows-2023
Jennifer Pattison Tuohy,https://www.theverge.com/authors/jennifer-tuohy,How to stream your security cameras to your Echo Show,https://www.theverge.com/23627516/echo-show-security-cameras-stream-smart-display-how-to
Jennifer Pattison Tuohy,https://www.theverge.com/authors/jennifer-tuohy,"Facebook’s new Portal Go is great for video calls, but not much else",https://www.theverge.com/22732472/facebook-portal-go-10-inch-2021-review
Chris Welch,https://www.theverge.com/authors/chris-welch,Apple TV 4K (third-generation) review: unmatched power at a much better price,https://www.theverge.com/23435393/apple-tv-4k-2022-third-gen-review-price-details
Jennifer Pattison Tuohy,https://www.theverge.com/authors/jennifer-tuohy,The Echo Show 8 is still the smart display to beat,https://www.theverge.com/23945192/amazon-echo-show-8-alexa-smart-display-review
Dan Seifert,https://www.theverge.com/authors/dan-seifert,Amazon’s new Echo Show 8 is a little faster and has a better camera,https://www.theverge.com/22521948/amazon-echo-show-8-2nd-gen-2021-review
Jess Weatherbed,https://www.theverge.com/authors/jess-weatherbed,How to start a smart home using Amazon Alexa,https://www.theverge.com/23751608/amazon-alexa-smart-home-controller-how-to
Jennifer Pattison Tuohy,https://www.theverge.com/authors/jennifer-tuohy,Eero’s top-of-the-line mesh Wi-Fi router is faster but flakier,https://www.theverge.com/23057029/eero-pro-6e-review-mesh-router-6-ghz-thread
Chris Welch,https://www.theverge.com/authors/chris-welch,Apple’s new HomePod plays it safe,https://www.theverge.com/23578606/apple-homepod-2-second-gen-2023-siri-smart-speaker-review
Jennifer Pattison Tuohy,https://www.theverge.com/authors/jennifer-tuohy,How to connect Philips Hue with Apple HomeKit,https://www.theverge.com/23344595/philips-hue-apple-homekit-connect-how-to
Dan Seifert,https://www.theverge.com/authors/dan-seifert,"Amazon Echo Show 5 (second gen) review: small screen, small updates",https://www.theverge.com/22529891/amazon-echo-show-5-2nd-gen-alexa-smart-display-review
Sam Byford,https://www.theverge.com/authors/sam-byford,8BitDo now makes the best Switch pro controller,https://www.theverge.com/22364301/8bitdo-pro-2-controller-review-switch-back-buttons
Ash Parrish,https://www.theverge.com/authors/ash-parrish,The best shows on Max in 2023,https://www.theverge.com/24003340/max-best-shows-2023
Dan Seifert,https://www.theverge.com/authors/dan-seifert,Eero Pro 6 review: less pro than expected,https://www.theverge.com/22193059/eero-pro-6-review-mesh-router-wifi-6-test-speeds-network
Ash Parrish,https://www.theverge.com/authors/ash-parrish,2023’s great games were overshadowed by a dark cloud of layoffs,https://www.theverge.com/24009039/video-game-layoffs-2023
Jennifer Pattison Tuohy,https://www.theverge.com/authors/jennifer-tuohy,How to turn your Echo Show into a digital photo frame,https://www.theverge.com/22982857/how-to-echo-show-amazon-digital-photo-frame
Dieter Bohn,https://www.theverge.com/authors/dieter-bohn,iPad Pro (2021) review: dream screen,https://www.theverge.com/22442084/ipad-pro-2021-review-features-screen-mini-led-m1-processor
Victoria Song,https://www.theverge.com/authors/victoria-song,The Ray-Ban Meta smart glasses actually make the future look cool,https://www.theverge.com/23922425/ray-ban-meta-smart-glasses-review
Jennifer Pattison Tuohy,https://www.theverge.com/authors/jennifer-tuohy,The best floodlight camera to buy right now,https://www.theverge.com/22811985/best-smart-floodlight-security-camera
Jennifer Pattison Tuohy,https://www.theverge.com/authors/jennifer-tuohy,This iPod-like button could be a great smart home controller,https://www.theverge.com/24064662/linxura-smart-controller-review
Jennifer Pattison Tuohy,https://www.theverge.com/authors/jennifer-tuohy,Amazon bought iRobot to see inside your home,https://www.theverge.com/23293687/amazon-irobot-acquisition-purchase-smarthome-intelligence-privacy-analysis
Jennifer Pattison Tuohy,https://www.theverge.com/authors/jennifer-tuohy,How to use Zoom on the Echo Show,https://www.theverge.com/22928013/how-to-use-zoom-amazon-echo-show-alexa
Jennifer Pattison Tuohy,https://www.theverge.com/authors/jennifer-tuohy,Echo Hub hands-on: It’s all about the widgets,https://www.theverge.com/23882652/amazon-echo-hub-smart-home-controller-hands-on
Jennifer Pattison Tuohy,https://www.theverge.com/authors/jennifer-tuohy,The Echo Show 15 with Fire TV: a major upgrade with a major flaw,https://www.theverge.com/23510820/amazon-echo-show-15-fire-tv-update-hands-on
Jennifer Pattison Tuohy,https://www.theverge.com/authors/jennifer-tuohy,Samsung’s SmartThings Station is a smart home hub worth plugging in,https://www.theverge.com/23584507/samsung-smartthings-station-review-smart-home-hub-matter-thread
Andrew Webster,https://www.theverge.com/authors/andrew-webster,Foundation’s showrunner explains why big book adaptations start so dang slow,https://www.theverge.com/23786940/foundation-season-2-david-goyer-interview-apple-tv-plus
Jennifer Pattison Tuohy,https://www.theverge.com/authors/jennifer-tuohy,Why Siri is my favorite smart home controller,https://www.theverge.com/22704860/siri-best-smart-home-voice-assistant-editorial
Jennifer Pattison Tuohy,https://www.theverge.com/authors/jennifer-tuohy,How to enable Alexa person and package announcements on an Echo speaker,https://www.theverge.com/23059001/enable-amazon-alexa-person-package-anouncements-how-to
Jennifer Pattison Tuohy,https://www.theverge.com/authors/jennifer-tuohy,How to use the Apple HomePod’s temperature and humidity sensors,https://www.theverge.com/23574268/homepod-temperature-and-humidity-sensor-how-to-use
Dan Seifert,https://www.theverge.com/authors/dan-seifert,How to change Alexa’s voice,https://www.theverge.com/22588961/alexa-voice-echo-male-female-celebrity-how-to-change
Jennifer Pattison Tuohy,https://www.theverge.com/authors/jennifer-tuohy,How to use a Google Nest Hub as a digital picture frame,https://www.theverge.com/23041642/google-nest-hub-digital-picture-frame-how-to
Jennifer Pattison Tuohy,https://www.theverge.com/authors/jennifer-tuohy,How to upgrade to the new Apple Home architecture,https://www.theverge.com/23512574/apple-home-architecture-new-upgrade-how-to
Verge Staff,https://www.theverge.com/authors/verge-staff,Foundation: all the latest on Apple’s sci-fi epic,https://www.theverge.com/23791069/foundation-apple-tv-plus-trailers-news-reviews
Jon Porter,https://www.theverge.com/authors/jon-porter,"Amazon Basics ripped off accessories, now Amazon is coming for gadgets",https://www.theverge.com/22701965/amazon-fitbit-ecobee-basics-design-halo-view-smart-thermostat-clone-ripoff-regulators
Dan Seifert,https://www.theverge.com/authors/dan-seifert,Google’s latest Nest Doorbell and camera are not obvious upgrades,https://www.theverge.com/22710545/nest-doorbell-battery-cam-battery-test-review-price-specs-features
Verge Staff,https://www.theverge.com/authors/verge-staff,All the news about Netflix’s gaming efforts,https://www.theverge.com/22772589/netflix-video-games-app-news-updates
Charles Pulliam-Moore,https://www.theverge.com/authors/charles-pulliam-moore,Amazon’s The Lord of the Rings: The Rings of Power is small-screen high fantasy done right,https://www.theverge.com/23329415/the-lord-of-the-rings-of-power-review-amazon-prime
Jennifer Pattison Tuohy,https://www.theverge.com/authors/jennifer-tuohy,"The new Echo Show 8 is smarter, speedier, and knows when you get close",https://www.theverge.com/23882844/amazon-echo-show-8-smart-display-hands-on
Dieter Bohn,https://www.theverge.com/authors/dieter-bohn,"Apple MacBook Air with M1 review: new chip, no problem",https://www.theverge.com/21569603/apple-macbook-air-m1-review-price-specs-features-arm-silicon
