author_name,author_profile_link,title,url
Corin Faife,https://www.theverge.com/authors/corin-faife,Explaining crypto’s billion-dollar bridge problem,https://www.theverge.com/23017107/crypto-billion-dollar-bridge-hack-decentralized-finance
Andrew Webster,https://www.theverge.com/authors/andrew-webster,Playdate hands-on: a Game Boy from a different dimension,https://www.theverge.com/22587172/playdate-hands-on-preview
Andrew Webster,https://www.theverge.com/authors/andrew-webster,The PlayStation Vita still rules,https://www.theverge.com/24121232/sony-playstation-vita-steam-deck-switch
Ash Parrish,https://www.theverge.com/authors/ash-parrish,New Castlevania: Nocturne trailer is all about Bloodlines,https://www.theverge.com/23863001/netflix-castlevania-nocturne-trailer-early-digital-release-twitch
Andrew Webster,https://www.theverge.com/authors/andrew-webster,The Playdate makes a surprisingly good e-reader,https://www.theverge.com/24191461/playdate-ereader-app-playbook-panic-teenage-engineering
Alice Jovanée,https://www.theverge.com/authors/alice-newcome-beill,The best deals from Amazon’s October Prime Day you can still get,https://www.theverge.com/23402251/amazon-prime-day-2022-best-deals-still-available-headphones-tablets-gaming
Sam Byford,https://www.theverge.com/authors/sam-byford,"There’s finally a new Densha de Go! train controller, and it’s awesome",https://www.theverge.com/22628513/densha-de-go-switch-controller-review-hashirou-yamanote-sen
Cameron Faulkner,https://www.theverge.com/authors/cameron-faulkner,Sony’s 27-inch 4K gaming monitor is good but not $900 good,https://www.theverge.com/23290663/sony-27-inch-4k-inzone-gaming-monitor-review-ps5-pc
Andrew Webster,https://www.theverge.com/authors/andrew-webster,The DS was Nintendo at its best and weirdest,https://www.theverge.com/21441254/nintendo-ds-3ds-discontinued-eulogy
Andrew Webster,https://www.theverge.com/authors/andrew-webster,Playdate review: all it’s cranked up to be,https://www.theverge.com/23025390/playdate-handheld-portable-gaming-console-review
Victoria Song,https://www.theverge.com/authors/victoria-song,Aura Strap 2 review: context — you love to see it,https://www.theverge.com/23066781/aura-strap-2-review-apple-watch-bia
Cameron Faulkner,https://www.theverge.com/authors/cameron-faulkner,Here’s how to preorder (almost) all of Amazon’s latest tech,https://www.theverge.com/23376866/amazon-2022-preorder-kindle-scribe-halo-rise-echo-dot-eero-fire-tv-cube-omni-auto-ring-sale
Chris Welch,https://www.theverge.com/authors/chris-welch,The best soundbars to buy in 2022,https://www.theverge.com/22950789/best-soundbar
Chris Welch,https://www.theverge.com/authors/chris-welch,Jabra Elite 85t review: noise cancellation isn’t the only big change,https://www.theverge.com/21549587/jabra-elite-85t-review-features-specs-price
Harrison Jacobs,https://www.theverge.com/authors/harrison-jacobs,The counterfeit NFT problem is only getting worse,https://www.theverge.com/22905295/counterfeit-nft-artist-ripoffs-opensea-deviantart
Andrew Webster,https://www.theverge.com/authors/andrew-webster,The playful Playdate gets serious as a personal organizer,https://www.theverge.com/23068657/playdate-pocket-planner-app-hands-on-personal-organizer
Antonio G. Di Benedetto,https://www.theverge.com/authors/antonio-g-di-benedetto,Win a mystery bag of free stuff from The Verge and The Strategist,https://www.theverge.com/23351542/mystery-bag-sweepstakes-strategist-tech-lifestyle-gadgets
Parker Ortolani,https://www.theverge.com/authors/parker-ortolani,Take up to 50% off of merch from The Verge for Black Friday and Cyber Monday,https://www.theverge.com/23969777/verge-merch-black-friday-cyber-monday-sale
Sheena Vasani,https://www.theverge.com/authors/sheena-vasani,The best Amazon Prime Day deals under $50,https://www.theverge.com/23393413/amazon-prime-deals-under-50-best-cheap-early-access-tech-2022
Sheena Vasani,https://www.theverge.com/authors/sheena-vasani,The best Apple deals available for Amazon Prime Day 2022,https://www.theverge.com/23393414/amazon-prime-sale-apple-deals-airpods-ipad-2022
Sheena Vasani,https://www.theverge.com/authors/sheena-vasani,25 deals from Amazon’s fall Prime Day event that make for great gifts,https://www.theverge.com/23400057/amazon-prime-gift-deals-tech-sale-holiday-airpods-speakers-camera
Adi Robertson,https://www.theverge.com/authors/adi-robertson,"Section 230 is 25 years old, and it’s never been more important",https://www.theverge.com/22268421/cda-section-230-25th-anniversary-reform-stakes-big-tech-internet
Chris Welch,https://www.theverge.com/authors/chris-welch,Making sense of new TV features in 2022,https://www.theverge.com/22884014/tv-features-hardware-screens-hdmi-hdr-vrr-oled-mini-led
Cameron Faulkner,https://www.theverge.com/authors/cameron-faulkner,How modders rebuilt Resident Evil 4’s graphics from scratch,https://www.theverge.com/22309983/resident-evil-4-hd-project-remake-remaster-mod-pc-textures-graphics
Verge Staff,https://www.theverge.com/authors/verge-staff,Lego isn’t just for kids: the latest news for nostalgic adults and adult budgets,https://www.theverge.com/23793880/lego-adults-welcome-new-sets-storystream
Alice Jovanée,https://www.theverge.com/authors/alice-newcome-beill,The best gaming deals from fall Prime Day,https://www.theverge.com/23393295/amazon-prime-deals-best-game-gaming-console-2022
Sean Hollister,https://www.theverge.com/authors/sean-hollister,Lego returns to The Lord of the Rings with a $500 Rivendell set,https://www.theverge.com/23588895/lego-rivendell-lord-of-the-rings-lotr-pictures-price-release-date
Parker Ortolani,https://www.theverge.com/authors/parker-ortolani,The Verge and Nomad have made an Apple Watch band,https://www.theverge.com/24181102/verge-nomad-apple-watch-band
Parker Ortolani,https://www.theverge.com/authors/parker-ortolani,The Verge store is back with lots of brand-new gear,https://www.theverge.com/24182647/verge-store-merch-shirt-hoodie-mug
Andrew Liszewski,https://www.theverge.com/authors/andrew-liszewski,Bumblebee joins Optimus Prime as the next Transformers Lego set,https://www.theverge.com/24177038/lego-transformers-bumblebee-set-beetle
Kait Sanchez,https://www.theverge.com/authors/kait-sanchez,"When games are hard on their hands, some players turn their voices into controllers",https://www.theverge.com/22303517/disabled-players-game-accessibility-voice-control
Monica Chin,https://www.theverge.com/authors/monica-chin,Elite students are debating hot-button issues on an invite-only TikTok clone,https://www.theverge.com/22588932/polemix-app-tiktok-clone-students-invite-only-debating-app
Umar Shakir,https://www.theverge.com/authors/umar-shakir,Lego’s new Retro Radio is just for looks,https://www.theverge.com/24152765/lego-retro-radio-icons
Bijan Stephen,https://www.theverge.com/authors/bijan-stephen,Stream it yourself,https://www.theverge.com/22303070/twitch-makers-crafting-diy-woodworking-leatherworking
Sean Hollister,https://www.theverge.com/authors/sean-hollister,The perfect Lego Nintendo Game Boy doesn’t exist...,https://www.theverge.com/21578775/lego-nintendo-game-boy-fan-model-nick-lever-masters
Alice Jovanée,https://www.theverge.com/authors/alice-newcome-beill,The Verge’s 2022 fall gift guide,https://www.theverge.com/23357267/fall-gift-ideas-2022-tech-gadgets-birthday-anniversary-wedding
Sean Hollister,https://www.theverge.com/authors/sean-hollister,The engineers building ridiculous dart blasters that Nerf won’t touch,https://www.theverge.com/22324389/nerf-gun-diy-homemade-blaster-out-of-darts-jupiter-caliburn-captain-slug-hasbro
Alexandra Marvar,https://www.theverge.com/authors/alexandra-marvar,The teen tycoons of Depop,https://www.theverge.com/22580446/depop-online-vintage-sales-business-algorithm-dangers
Stitch,https://www.theverge.com/authors/stitch,K-pop’s fandom platforms are changing what it means to be an idol,https://www.theverge.com/22589460/kpop-fan-cafe-weverse-universe-lysn-bts-idol-fandom-group
Cameron Faulkner,https://www.theverge.com/authors/cameron-faulkner,LG’s 16:18 DualUp is a weird monitor for getting work done,https://www.theverge.com/23273991/lg-dualup-tall-pc-windows-mac-monitor-review
Tanvi Misra,https://www.theverge.com/authors/tanvi-misra,The children of tech’s guest workers are pushing for immigration relief,https://www.theverge.com/22585007/h1b-dependent-visa-age-out-documented-dreamers-immigration-reform
Matt Smith,https://www.theverge.com/authors/matt-smith,How to pick a new monitor for working from home,https://www.theverge.com/22877788/best-monitor-work-from-home-screen-choice-4k-qhd-refresh-rate-ultrawide
Kim Lyons,https://www.theverge.com/authors/kim-lyons,Artists are playing takedown whack-a-mole to fight counterfeit merch,https://www.theverge.com/22924353/artists-counterfeit-merch-facebook-amazon-etsy-dmca
Kim Lyons,https://www.theverge.com/authors/kim-lyons,Rescuing discarded fabric for designer bow ties,https://www.theverge.com/22309827/knotzland-bow-ties-upcycling
Mirna Rodriguez,https://www.theverge.com/authors/mirna-rodriguez,Next Gen Favorites: Wattpad,https://www.theverge.com/22585864/wattpad-fanfiction-platform-library-writing
Justine Calma,https://www.theverge.com/authors/justine-calma,How scientists scrambled to stop Donald Trump’s EPA from wiping out climate data,https://www.theverge.com/22313763/scientists-climate-change-data-rescue-donald-trump
Jamal Burns,https://www.theverge.com/authors/jamal-burns,Next Gen Favorites: the half-finished Duolingo course,https://www.theverge.com/22583950/duolingo-language-learning-anxiety
Kait Sanchez,https://www.theverge.com/authors/kait-sanchez,How a teen punk led a movement for disabled people online,https://www.theverge.com/22583848/disabled-teen-cripple-punk-media-representation
Chantal Flores,https://www.theverge.com/authors/chantal-flores,How Facebook became a lifeline for immigrant bike messengers,https://www.theverge.com/22580094/facebook-bike-messenger-group-undocumented-support-delivery-drivers
Julia Alexander,https://www.theverge.com/authors/julia-alexander,Making fanfiction beautiful enough for a bookshelf,https://www.theverge.com/22311788/fanfiction-bookbinding-tiktok-diy-star-wars-harry-potter-twitter-fandom
Chantal Flores,https://www.theverge.com/authors/chantal-flores,"When Wendy Sánchez went missing, her brother built a campaign to find her",https://www.theverge.com/22312221/tebuscamoswendy-wendy-sanchez-nayarit-disappearance-social-media-campaign
Cameron Faulkner,https://www.theverge.com/authors/cameron-faulkner,A former pro is helping figure skating look more authentic than ever,https://www.theverge.com/22303559/on-ice-perspectives-instagram-youtube-social-media-figure-skating-cinematography
Mia Sato,https://www.theverge.com/authors/mia-sato,The plus-size knitters who are solving an inclusivity problem,https://www.theverge.com/22309480/knitters-plus-size-crowdsourcing-social-media-inclusivity-design
Kaitlin Hatton,https://www.theverge.com/authors/kaitlin-hatton,The art of upcycling old sneakers into high-fashion corsets,https://www.theverge.com/22308066/sustainable-fashion-sneaker-corsets-bodysuits-upcycling-friskmegood
Emma Banks,https://www.theverge.com/authors/emma-banks,Grassroots online efforts are forming a new queer network of care,https://www.theverge.com/22303892/queer-care-networks-online-queercare-for-the-gworls-transanta
Nilay Patel,https://www.theverge.com/authors/nilay-patel,Apple Studio Display review: nothing to see here,https://www.theverge.com/22981744/apple-studio-display-5k-monitor-webcam-speakers-review
Isaac Espinosa,https://www.theverge.com/authors/isaac-espinosa,Next Gen Favorites: Parsec,https://www.theverge.com/22583897/parsec-gaming-remote-multiplayer-console
Andrew J. Hawkins,https://www.theverge.com/authors/andrew-j-hawkins,The DIY e-bike scene is obsessed with speed and clout,https://www.theverge.com/22296195/electric-bike-ebike-diy-youtube-conversion-kit-cost
Verge Staff,https://www.theverge.com/authors/verge-staff,Our 14 favorite gadgets and hacks for working at home,https://www.theverge.com/22252470/work-from-home-remote-gadgets-recommendations
Aliya Chaudhry,https://www.theverge.com/authors/aliya-chaudhry,How to set up a Slack account,https://www.theverge.com/22905189/slack-account-set-up-messages-channels-work-remote-office
Andrew Webster,https://www.theverge.com/authors/andrew-webster,Good Sudoku on the iPhone teaches you the beauty of sudoku,https://www.theverge.com/21334116/good-sudoku-iphone-ipad-app-game-zach-gage
Aliya Chaudhry,https://www.theverge.com/authors/aliya-chaudhry,How to use Slack channels,https://www.theverge.com/22906230/how-to-use-slack-channels
Makena Kelly,https://www.theverge.com/authors/makena-kelly,Hasan Piker on the problem with YouTube debate culture,https://www.theverge.com/22556239/hasan-piker-twitch-gore-vidal-steven-crowder-sam-seder-h3-podcast-ethan-klein
Luke Winkie,https://www.theverge.com/authors/luke-winkie,The pirate assembling a better sports streaming service,https://www.theverge.com/22303642/hehestreams-pirate-sports-streaming-service-nba-nfl-mlb-nhl
Cameron Faulkner,https://www.theverge.com/authors/cameron-faulkner,The best webcam to buy right now,https://www.theverge.com/22652783/best-webcam-camera
Chantal Flores,https://www.theverge.com/authors/chantal-flores-2,Mexico’s cultural appropriation ban is off to a messy start,https://www.theverge.com/22924327/mexico-cultural-appropriation-law-indigenous-and-afro-mexican-communities
Mansee Khurana,https://www.theverge.com/authors/mansee-khurana,"Knitwear is slow, the knockoffs come fast",https://www.theverge.com/22905293/knitwear-knockoffs-designers-fast-fashion
David Strom,https://www.theverge.com/authors/david-strom,Why you might want a secure file-sharing service now that you’re working from home,https://www.theverge.com/22867623/file-share-secure-work-from-home-how-to-cloud
Brent Rose,https://www.theverge.com/authors/brent-rose,How to make your home office a more pleasant place to work,https://www.theverge.com/22867128/home-office-better-light-desk-chair-snacks-massage-plants
Barbara Krasnoff,https://www.theverge.com/authors/barbara-krasnoff,All the ways to turn your phone or camera into a webcam,https://www.theverge.com/21523161/phone-camera-webcam-how-to-iphone-android-dslr
Barbara Krasnoff,https://www.theverge.com/authors/barbara-krasnoff,How to choose the right printer for your home office,https://www.theverge.com/21279634/best-printer-recommendations-laser-multifunction-inkjet-canon-epson-brother-hp-home-office
Charles Pulliam-Moore,https://www.theverge.com/authors/charles-pulliam-moore,Castlevania: Nocturne’s first trailer puts Richter Belmont in the revolutionary spotlight,https://www.theverge.com/23809274/castlevania-nocturne-trailer-neflix-konami-richter-belmont
Mitchell Clark,https://www.theverge.com/authors/mitchell-clark,"Blockchain, explained",https://www.theverge.com/22654785/blockchain-explained-cryptocurrency-what-is-stake-nft
Sheena Vasani,https://www.theverge.com/authors/sheena-vasani,The best Prime Day deals on Amazon devices,https://www.theverge.com/23197003/amazon-prime-day-devices-alexa-echo-ring-smart-home-2022
Chris Welch,https://www.theverge.com/authors/chris-welch,The best headphone deals from Amazon’s fall Prime Day sale,https://www.theverge.com/23398304/amazon-prime-deals-best-headphone-earbuds-2022
Verge Staff,https://www.theverge.com/authors/verge-staff,"Amazon Prime Early Access Sale: the latest news, deals, and coverage",https://www.theverge.com/23387398/amazon-prime-early-access-sale-2022-deals-news-date-time-retailer
Barbara Krasnoff,https://www.theverge.com/authors/barbara-krasnoff,How to keep your Zoom meetings safe and secure,https://www.theverge.com/22869237/zoom-video-meeting-how-to-security
Andrew Webster,https://www.theverge.com/authors/andrew-webster,"Night Sky is a warm, comforting sci-fi with too much filler",https://www.theverge.com/23124019/night-sky-review-amazon-prime-video
Cameron Faulkner,https://www.theverge.com/authors/cameron-faulkner,Opal’s C1 offers DSLR-rivaling video quality in a small form factor,https://www.theverge.com/22834196/opal-c1-webcam-camera-dslr-video-quality-performance-review-price
David Pierce,https://www.theverge.com/authors/david-pierce,Why every company wants a podcast now,https://www.theverge.com/24318644/podcast-election-vc-marketing-business-decoder-interview
Cameron Faulkner,https://www.theverge.com/authors/cameron-faulkner,How to use your Android or iOS device as a webcam,https://www.theverge.com/21281765/webcam-phone-tablet-android-ios-pc-mac-how-to
Aliya Chaudhry,https://www.theverge.com/authors/aliya-chaudhry,How to send private messages and make calls in Slack,https://www.theverge.com/22857495/slack-private-messages-make-calls-how-to
Alex Cranz,https://www.theverge.com/authors/alex-cranz,The trials and tribulations of turning a real camera into a webcam,https://www.theverge.com/22841507/mirrorless-webcam-sony-a7-iii-imaging-edge-overheating
Ash Parrish,https://www.theverge.com/authors/ash-parrish,The quest to save a Stadia exclusive,https://www.theverge.com/23522519/pixeljunk-raiders-google-stadia-q-games
David Pierce,https://www.theverge.com/authors/david-pierce,Who killed Google Reader?,https://www.theverge.com/23778253/google-reader-death-2013-rss-social
Andrea Plascencia,https://www.theverge.com/authors/andrea-plascencia,Next Gen Favorites: the Alicia Keys Tiny Desk concert,https://www.theverge.com/22583910/alicia-keys-tiny-desk-concert-live-music-lockdown
Cameron Faulkner,https://www.theverge.com/authors/cameron-faulkner,Sony’s colorful DualSense controllers harmonize with my color palette,https://www.theverge.com/22878067/sony-dualsense-controller-color-purple-blue-pink-hands-on
Nilay Patel,https://www.theverge.com/authors/nilay-patel,Microsoft CTO Kevin Scott thinks Sydney might make a comeback,https://www.theverge.com/23733388/microsoft-kevin-scott-open-ai-chat-gpt-bing-github-word-excel-outlook-copilots-sydney
Antonio G. Di Benedetto,https://www.theverge.com/authors/antonio-g-di-benedetto,The best Cyber Monday Google deals you can get,https://www.theverge.com/23473576/black-friday-2022-google-deals-cyber-monday-pixel-watch-buds-nest-chromecast
Jason Snell,https://www.theverge.com/authors/jason-snell,The Mac Studio is myth fulfillment,https://www.theverge.com/22974998/apple-xmac-myth-midrange-mid-tower-mac-studio
Sheena Vasani,https://www.theverge.com/authors/sheena-vasani,How to preorder Apple’s new iPad Air,https://www.theverge.com/22958901/apple-ipad-air-2022-preorder-how-to-buy-price-release-date
Verge Staff,https://www.theverge.com/authors/verge-staff,What we listen to while working from home,https://www.theverge.com/21373558/music-video-ebooks-tv-favorites-work-from-home
Alice Jovanée,https://www.theverge.com/authors/alice-newcome-beill,The best anti-Prime Day tech deals happening at Best Buy,https://www.theverge.com/23199051/best-buy-deals-black-friday-july-sale-prime-day-tech-2022
Antonio G. Di Benedetto,https://www.theverge.com/authors/antonio-g-di-benedetto,Where to preorder the colorful new PS5 covers and DualSense controllers,https://www.theverge.com/22865349/ps5-playstation-5-console-covers-where-buy-dualsense-controllers-colors-price-preorder
Sheena Vasani,https://www.theverge.com/authors/sheena-vasani,The best anti-Prime Day tech deals happening at Target,https://www.theverge.com/23198671/target-deal-days-sale-prime-day-tech-2022
Barbara Krasnoff,https://www.theverge.com/authors/barbara-krasnoff,How to sign up for Amazon Prime,https://www.theverge.com/21493780/amazon-prime-sign-up-day-deals-sale-price-free
Antonio G. Di Benedetto,https://www.theverge.com/authors/antonio-g-di-benedetto,The Verge’s 2021 holiday gift guide for working from home,https://www.theverge.com/22746680/work-from-home-remote-office-holiday-gift-guide-2021-supplies-tech-gadgets
Steven Vaughan-Nichols,https://www.theverge.com/authors/steven-vaughan-nichols,How to switch an old Windows laptop to Linux,https://www.theverge.com/21550815/windows-microsoft-linux-mint-laptop-how-to-switch
Brent Rose,https://www.theverge.com/authors/brent-rose,Levels Health review: optimize your fitness with a $400 glucose tracker,https://www.theverge.com/22794594/levels-health-glucose-fitness-tracker-review
Barbara Krasnoff,https://www.theverge.com/authors/barbara-krasnoff,The Verge’s 10 favorite gadgets that cost less than $50,https://www.theverge.com/21538325/gadgets-cheap-tracker-gamepad-panasonic
Chris Welch,https://www.theverge.com/authors/chris-welch,How to use Google’s budget feature on Android so you don’t overspend,https://www.theverge.com/21525368/google-budget-android-feature-how-to
Verge Staff,https://www.theverge.com/authors/verge-staff,"Amazon Prime Day 2022: the latest news, deals, and coverage",https://www.theverge.com/23191701/amazon-prime-day-2022-deals-news-date-time-retailer-sales
Allison Johnson,https://www.theverge.com/authors/allison-johnson,These are the best Prime Day 2022 phone deals,https://www.theverge.com/23201958/amazon-prime-day-best-phone-deals-2022
Sam Byford,https://www.theverge.com/authors/sam-byford,Game Gear Micro review: peak Sega,https://www.theverge.com/21519010/sega-game-gear-micro-review
Nilay Patel,https://www.theverge.com/authors/nilay-patel,John Deere turned tractors into computers — what’s next?,https://www.theverge.com/22533735/john-deere-cto-hindman-decoder-interview-right-to-repair-tractors
Jay Peters,https://www.theverge.com/authors/jay-peters,How Reddit crushed the biggest protest in its history,https://www.theverge.com/23779477/reddit-protest-blackouts-crushed
Jay Castello,https://www.theverge.com/authors/jay-castello,How a design museum unearthed a treasure trove of classic Slovak games,https://www.theverge.com/22882705/slovak-design-museum-classic-game-preservation-1980s
Cameron Faulkner,https://www.theverge.com/authors/cameron-faulkner,The best Cyber Monday deals on Apple devices,https://www.theverge.com/23466789/apple-black-friday-2022-deals-cyber-monday-macbook-ipad-airtags-watch
Chaim Gartenberg,https://www.theverge.com/authors/chaim-gartenberg,Apple’s chips are on the table,https://www.theverge.com/22972996/apple-silicon-arm-double-size-mac-m1-pro-max-ultra-a15
Barbara Krasnoff,https://www.theverge.com/authors/barbara-krasnoff,How to change your name and add a photo to Zoom,https://www.theverge.com/21367945/zoom-photo-name-change-how-to-videoconferencing-wfh
Victoria Song,https://www.theverge.com/authors/victoria-song,How to install the watchOS 9 public beta,https://www.theverge.com/23200213/watchos-9-beta-install-how-to
Barbara Krasnoff,https://www.theverge.com/authors/barbara-krasnoff,Budget roundup: the latest low-cost cameras,https://www.theverge.com/21527395/budget-cameras-gopro-polaroid-fujifilm-low-cost-cheap
Antonio G. Di Benedetto,https://www.theverge.com/authors/antonio-g-di-benedetto,The best Amazon Prime Day deals on work-from-home tech,https://www.theverge.com/23207333/amazon-prime-day-best-home-office-work-tech-deals-2022
Alice Jovanée,https://www.theverge.com/authors/alice-newcome-beill,Amazon Prime Day 2022: the best deals still available,https://www.theverge.com/23215654/amazon-prime-day-best-tech-deals-still-available-games-headphones-laptops-2022
Victoria Song,https://www.theverge.com/authors/victoria-song,Best smartwatch and fitness tracker deals for Amazon Prime Day 2022,https://www.theverge.com/23203891/amazon-prime-day-best-fitness-tracker-smartwatch-deals-2022
Barbara Krasnoff,https://www.theverge.com/authors/barbara-krasnoff,Budget roundup: the latest low-cost iPhones and Android phones,https://www.theverge.com/21526773/budget-phones-cheap-iphones-android-low-cost
Alice Jovanée,https://www.theverge.com/authors/alice-newcome-beill,The best Prime Day 2022 tablet deals,https://www.theverge.com/23199072/amazon-prime-day-best-tablet-samsung-apple-ipad-deals-2022
Sheena Vasani,https://www.theverge.com/authors/sheena-vasani,Amazon Prime Day 2022: the best deals under $25,https://www.theverge.com/23205454/amazon-prime-day-best-cheap-deals-under-25-2022
Cameron Faulkner,https://www.theverge.com/authors/cameron-faulkner,The Verge’s 2021 holiday gift guide for dads,https://www.theverge.com/22752556/holiday-gift-ideas-dad-2021-unique-tech-gadgets
Chris Welch,https://www.theverge.com/authors/chris-welch,Prime Day 2022: the best headphone and earbud deals,https://www.theverge.com/23204301/amazon-prime-day-best-headphone-earbud-deals-2022
Barbara Krasnoff,https://www.theverge.com/authors/barbara-krasnoff,"Budget roundup: the latest low-cost speakers, headphones, and earbuds",https://www.theverge.com/21528395/cheap-speakers-headphones-earbuds-budget-razer-sony-beats
Antonio G. Di Benedetto,https://www.theverge.com/authors/antonio-g-di-benedetto,The best Prime Day 2022 deals on 4K TVs,https://www.theverge.com/23203819/amazon-prime-day-best-tv-deals-2022
Sheena Vasani,https://www.theverge.com/authors/sheena-vasani,The Verge’s favorite holiday gifts under $50,https://www.theverge.com/22748775/holiday-gift-guide-under-50-cheap-tech-gadgets-best-ideas
Sheena Vasani,https://www.theverge.com/authors/sheena-vasani,The Verge’s 2021 fitness and wellness gift guide,https://www.theverge.com/22746889/fitness-wellness-holiday-gift-guide-2021-fitness-trackers-watches
Barbara Krasnoff,https://www.theverge.com/authors/barbara-krasnoff,Budget roundup: the latest lower-cost Windows and Chromebook systems,https://www.theverge.com/21528540/budget-windows-10-chromebook-systems-acer-lenovo-cheap
Barbara Krasnoff,https://www.theverge.com/authors/barbara-krasnoff,Here are a few Verge favorites that are on sale for Amazon Prime Day,https://www.theverge.com/23207203/amazon-prime-day-favorites-deals-pet-kitchen-home-car-tech
