author_name,author_profile_link,title,url
Sheena Vasani,https://www.theverge.com/authors/sheena-vasani,The best ebook reader to buy right now,https://www.theverge.com/23769068/best-ebook-readers
David Pierce,https://www.theverge.com/authors/david-pierce,The best iPad to buy,https://www.theverge.com/23639378/best-ipad-apple-buy-model-price
Brandon Widder,https://www.theverge.com/authors/brandon-widder,Here are the best Apple Watch deals right now,https://www.theverge.com/21289209/best-apple-watch-deals
Allison Johnson,https://www.theverge.com/authors/allison-johnson,The best phone to buy right now,https://www.theverge.com/22163811/best-phone
Quentyn Kennemer,https://www.theverge.com/authors/quentyn-kennemer,The best Nintendo Switch controllers to buy right now,https://www.theverge.com/23350899/nintendo-switch-controllers-best-wireless-joy-con-gamepad
Allison Johnson,https://www.theverge.com/authors/allison-johnson,The best iPhones,https://www.theverge.com/23618862/best-iphone-camera-battery-screen-guide
Chris Welch,https://www.theverge.com/authors/chris-welch,The best wireless earbuds to buy right now,https://www.theverge.com/21309820/best-wireless-earbuds
Victoria Song,https://www.theverge.com/authors/victoria-song,The best fitness trackers to buy right now,https://www.theverge.com/22985108/best-fitness-tracker
Quentyn Kennemer,https://www.theverge.com/authors/quentyn-kennemer,The DJI Pocket 3 is almost everything I wanted my iPhone camera to be,https://www.theverge.com/24152949/dji-osmo-pocket-3-opinion
Victoria Song,https://www.theverge.com/authors/victoria-song,The best sleep gadgets to help you catch those Zzzs,https://www.theverge.com/23291925/best-sleep-tech-trackers-earbuds-wearables
Jennifer Pattison Tuohy,https://www.theverge.com/authors/jennifer-tuohy,The best robot vacuums,https://www.theverge.com/22997597/best-robot-vacuum-cleaner
Sheena Vasani,https://www.theverge.com/authors/sheena-vasani,The best instant cameras you can buy right now,https://www.theverge.com/23133103/best-instant-cameras-fujifilm-polaroid-kodak
Nathan Edwards,https://www.theverge.com/authors/nathan-edwards,This retro mechanical keyboard kit is all modern on the inside,https://www.theverge.com/24247498/classic-tkl-mechanical-keyboard-review
Dieter Bohn,https://www.theverge.com/authors/dieter-bohn,Apple Watch Series 7 review: time and time again,https://www.theverge.com/22722533/apple-watch-series-7-review-screen-watchos-features
Victoria Song,https://www.theverge.com/authors/victoria-song,Garmin’s Fenix 7S Sapphire Solar makes the case for smaller fitness watches,https://www.theverge.com/22937154/garmin-fenix-7s-review-fitness-tracker-smartwatch
Jennifer Pattison Tuohy,https://www.theverge.com/authors/jennifer-tuohy,Roborock S7 MaxV Ultra review: this bot cleans its own bottom,https://www.theverge.com/22960447/roborock-s7-maxv-ultra-review-robot-vacuum-mop-hybrid
Allison Johnson,https://www.theverge.com/authors/allison-johnson,The Pixel 8A and the camera you have with you,https://www.theverge.com/24154473/google-pixel-8a-camera-hands-on
Quentyn Kennemer,https://www.theverge.com/authors/quentyn-kennemer,Here are the best robot vacuum deals right now,https://www.theverge.com/24350561/best-robot-vacuum-mop-irobot-roomba-eufy-roborock-deals-sale
Verge Staff,https://www.theverge.com/authors/verge-staff,The best indie games we’re playing right now,https://www.theverge.com/24339574/indie-games-recommendations-pc-switch-steam-deck-best-new-hidden-gems
Victoria Song,https://www.theverge.com/authors/victoria-song,Garmin Venu Sq 2 review: an excellent Fitbit alternative,https://www.theverge.com/23500640/garmin-venu-sq-2-review-smartwatch-fitness-tracker
Chris Welch,https://www.theverge.com/authors/chris-welch,"Apple AirPods Pro (second-gen) review: same look, better everything else",https://www.theverge.com/23365910/apple-airpods-pro-second-generation-review
Verge Staff,https://www.theverge.com/authors/verge-staff,Nintendo Switch 2 announcement: all the news on the next console,https://www.theverge.com/24284512/nintendo-switch-2-direct-news-trailers-games-features
Jennifer Pattison Tuohy,https://www.theverge.com/authors/jennifer-tuohy,The best budget robot vacuums,https://www.theverge.com/23846479/best-budget-robot-vacuum-robot-mop
Jennifer Pattison Tuohy,https://www.theverge.com/authors/jennifer-tuohy,The best doorbell cameras,https://www.theverge.com/22954554/best-video-doorbell-camera
Chris Welch,https://www.theverge.com/authors/chris-welch,Bose QuietComfort Ultra Earbuds review: still great but a questionable ‘upgrade’,https://www.theverge.com/23883649/bose-quietcomfort-ultra-earbuds-review
Chris Welch,https://www.theverge.com/authors/chris-welch,Bose QuietComfort Earbuds II review: noise cancellation domination,https://www.theverge.com/23353777/bose-quietcomfort-earbuds-2-review
Victoria Song,https://www.theverge.com/authors/victoria-song,"Garmin Venu 3S review: right features, wrong price",https://www.theverge.com/23982519/garmin-venu-3s-review-smartwatch-sleep-tracking-wearable
Allison Johnson,https://www.theverge.com/authors/allison-johnson,Google Pixel 9 review: the phone that Android needs,https://www.theverge.com/24232480/google-pixel-9-review-screen-camera-battery
Victoria Song,https://www.theverge.com/authors/victoria-song,The Forerunner 165 series is the budget training watch Garmin needed,https://www.theverge.com/24107020/garmin-forerunner-165-music-review-smartwatch-wearables
