author_name,author_profile_link,title,url
Charles Pulliam-Moore,https://www.theverge.com/authors/charles-pulliam-moore,Echo brings the best of Netflix’s Marvel era energy to Disney Plus,https://www.theverge.com/24030104/marvel-echo-review-daredevil-mcu-disney-plus-hulu
Andrew Webster,https://www.theverge.com/authors/andrew-webster,Even J.Lo in a mech suit can’t save Netflix’s by-the-numbers AI thriller,https://www.theverge.com/24162731/netflix-atlas-review-jennifer-lopez-ai
Andrew Webster,https://www.theverge.com/authors/andrew-webster,Apple’s climate change drama Extrapolations is earnest and plausible but also has talking whales,https://www.theverge.com/23623905/extrapolations-review-apple-tv-plus
Andrew Webster,https://www.theverge.com/authors/andrew-webster,9 great Game Pass games for your Xbox,https://www.theverge.com/24317923/xbox-game-pass-best-games-2024-microsoft-pc
Andrew Webster,https://www.theverge.com/authors/andrew-webster,Silo’s mysteries only deepen in season 2,https://www.theverge.com/24295488/silo-season-2-review-apple-tv-plus
Andrew Webster,https://www.theverge.com/authors/andrew-webster,Lorelei and the Laser Eyes has turned me into a puzzle sicko,https://www.theverge.com/24157530/lorelei-and-the-laser-eyes-review-switch-steam
Ash Parrish,https://www.theverge.com/authors/ash-parrish,Astro Bot is the game you buy a PS5 for,https://www.theverge.com/24237778/astro-bot-review-ps5-game-of-the-year
Andrew Webster,https://www.theverge.com/authors/andrew-webster,Mario’s excellent run continues with Mario & Luigi: Brothership on the Switch,https://www.theverge.com/24287092/mario-and-luigi-brothership-review-nintendo-switch
Andrew Webster,https://www.theverge.com/authors/andrew-webster,Max’s Dune prequel series starts streaming this fall,https://www.theverge.com/24157282/dune-prophet-prequel-series-max-trailer
Ash Parrish,https://www.theverge.com/authors/ash-parrish,2024’s best games channeled the heart and soul of the ’90s,https://www.theverge.com/24325371/2024s-best-games-classic-genres-astro-bot-balatro-metaphor
Sara Merican,https://www.theverge.com/authors/sara-merican,"Apple’s Dr. Brain is a bold, genre-bending thriller",https://www.theverge.com/22765207/dr-brain-review-apple-tv-plus
Ash Parrish,https://www.theverge.com/authors/ash-parrish,"Manor Lords is slow and frustrating, and I can’t stop playing",https://www.theverge.com/24147616/manor-lords-steam-early-access
Tauriq Moosa,https://www.theverge.com/authors/tauriq-moosa,Hellblade II’s stunning world is alive with horror,https://www.theverge.com/24161514/hellblade-2-review-xbox-pc
Andrew Webster,https://www.theverge.com/authors/andrew-webster,Crow Country is a gloriously grimy revival of ’90s survival horror,https://www.theverge.com/24153478/crow-country-review-steam-ps5-xbox
Charles Pulliam-Moore,https://www.theverge.com/authors/charles-pulliam-moore,The Creator retreads familiar AI panic territory to stunningly inert effect,https://www.theverge.com/23889089/the-creator-movie-review-gareth-edwards
Andrew Webster,https://www.theverge.com/authors/andrew-webster,Bowser’s Fury is a heavy metal remix of Super Mario 3D World,https://www.theverge.com/22250703/super-mario-3d-world-bowsers-fury-nintendo-switch-hands-on-preview
Elizabeth Lopatto,https://www.theverge.com/authors/elizabeth-lopatto,Who’s afraid of Gary Gensler?,https://www.theverge.com/24280387/gary-gensler-sec-chair-presidential-election-2024
Andrew Webster,https://www.theverge.com/authors/andrew-webster,Take it slow in this stop-motion sci-fi adventure,https://www.theverge.com/24131922/harold-halibut-review-ps5-xbox-steam
Andrew J. Hawkins,https://www.theverge.com/authors/andrew-j-hawkins,This election will decide what kind of car you’ll buy,https://www.theverge.com/24279434/presidential-election-trump-biden-harris-ev-2024-electric-vehicle-car
Dan Rosenbaum,https://www.theverge.com/authors/dan-rosenbaum,How to use Alexa’s Drop In feature,https://www.theverge.com/24093353/how-to-use-alexas-drop-in-feature
Andrew Webster,https://www.theverge.com/authors/andrew-webster,Netflix’s Jung_E adds heart to a story about AI brains,https://www.theverge.com/23560518/jung-e-review-netflix
Charles Pulliam-Moore,https://www.theverge.com/authors/charles-pulliam-moore,Marvel’s new Spotlight branding will help you cut through the MCU’s noise,https://www.theverge.com/23949013/marvel-spotlight-echo
Jess Weatherbed,https://www.theverge.com/authors/jess-weatherbed,The first trailer for Extrapolations features a cast only Apple money can buy,https://www.theverge.com/23600726/extrapolations-apple-tv-series-trailer-streaming-climate-disaster
Ash Parrish,https://www.theverge.com/authors/ash-parrish,"Princess Peach: Showtime! is clever and playful, but Peach deserves more",https://www.theverge.com/24112407/princess-peach-showtime-review-nintendo-switch
Andrew Webster,https://www.theverge.com/authors/andrew-webster,Apple’s latest sci-fi drama Invasion starts out too dang slow,https://www.theverge.com/22740520/invasion-review-apple-tv-plus
Sarah Jeong,https://www.theverge.com/authors/sarah-jeong,Trump’s takeover of the entire legal system hinges on this election,https://www.theverge.com/24279829/trump-supreme-court-federal-judiciary-judges
Andrew Webster,https://www.theverge.com/authors/andrew-webster,Ted Lasso season 3 starts with a full-on existential crisis,https://www.theverge.com/23621914/ted-lassos-season-3-review-premiere-apple-tv-plus
Ash Parrish,https://www.theverge.com/authors/ash-parrish,Age of Empires II: Definitive Edition plays great on console,https://www.theverge.com/23578144/age-of-empires-ii-definitive-edition-xbox-controller
Aron Garst,https://www.theverge.com/authors/aron-garst,Fortnite and Roblox are dueling for the future of user-built games,https://www.theverge.com/23674121/fortnite-roblox-user-generated-games
Andrew Webster,https://www.theverge.com/authors/andrew-webster,"Sometimes you just need a straightforward, old-school RPG",https://www.theverge.com/24297436/dragon-quest-3-hd-2d-remake-review
Shannon Liao,https://www.theverge.com/authors/shannon-liao,Why classic gaming names like Atari and MapleStory are still going in on the blockchain,https://www.theverge.com/23680785/retro-gaming-atari-maplestory-blockchain
Ash Parrish,https://www.theverge.com/authors/ash-parrish,Dragon’s Dogma 2 gets a March release date and tricky new class,https://www.theverge.com/23979909/dragons-dogma-2-release-date-trailer-capcom
Verge Staff,https://www.theverge.com/authors/verge-staff,GDC 2023: all the latest from the Game Developers Conference,https://www.theverge.com/23647882/gdc-2023-game-developer-conference-news-announcements-interviews
Ash Parrish,https://www.theverge.com/authors/ash-parrish,I hated Animal Well until I beat the game,https://www.theverge.com/24162572/animal-well-platforming-difficulty-bigmode
Barbara Krasnoff,https://www.theverge.com/authors/barbara-krasnoff,How caregivers are using smart tech to help aging parents,https://www.theverge.com/24080494/smart-home-assistant-amazon-alexa-caregiver-elders
Ash Parrish,https://www.theverge.com/authors/ash-parrish,Capcom’s Kunitsu-Gami combines tower defense strategy with the heart of community organizing,https://www.theverge.com/24202033/kunitsu-gami-path-of-the-goddess-review-capcom
Verge Staff,https://www.theverge.com/authors/verge-staff,"What SCOTUS just did to broadband, the right to repair, the environment, and more",https://www.theverge.com/24188365/chevron-scotus-net-neutrality-dmca-visa-fcc-ftc-epa
Nilay Patel,https://www.theverge.com/authors/nilay-patel,A vote for Donald Trump is a vote for school shootings and measles,https://www.theverge.com/24282022/kamala-harris-endorsement-presidential-election-2024
Ash Parrish,https://www.theverge.com/authors/ash-parrish,Princess Peach: Showtime! debuts on Nintendo Switch next year,https://www.theverge.com/23872851/princess-peach-showtime-nintendo-direct-trailer
Gaby Del Valle,https://www.theverge.com/authors/gaby-del-valle,The grievance-driven blueprint for the next Trump administration,https://www.theverge.com/24279329/project-2025-tech-policy-guide-trump-admin
Verge Staff,https://www.theverge.com/authors/verge-staff,From ChatGPT to Gemini: how AI is rewriting the internet,https://www.theverge.com/23610427/chatbots-chatgpt-new-bing-google-bard-conversational-ai
Charles Pulliam-Moore,https://www.theverge.com/authors/charles-pulliam-moore,Artificial intelligence has humanity on the ropes in The Creator’s first trailer,https://www.theverge.com/23727157/the-creator-gareth-edwards-trailer
Ash Parrish,https://www.theverge.com/authors/ash-parrish,A beginner’s guide to beginning Baldur’s Gate 3,https://www.theverge.com/23818692/baldurs-gate-3-starting-guide-tips-how-to
Andrew Webster,https://www.theverge.com/authors/andrew-webster,The joy of getting lost in Animal Well’s cryptic world,https://www.theverge.com/24152153/animal-well-review-switch-ps5-steam-videogamedunkey
David Pierce,https://www.theverge.com/authors/david-pierce,2023 in social media: the case for the fediverse,https://www.theverge.com/23990974/social-media-2023-fediverse-mastodon-threads-activitypub
Verge Staff,https://www.theverge.com/authors/verge-staff,The 2024 election,https://www.theverge.com/24187615/2024-us-election-biden-trump-president
Ash Parrish,https://www.theverge.com/authors/ash-parrish,Baldur’s Gate 3 on PS5 is a technically complicated but still enjoyable experience,https://www.theverge.com/23861883/baldurs-gate-3-ps5-technical-review
Chaim Gartenberg,https://www.theverge.com/authors/chaim-gartenberg,Ted Lasso doesn’t need surprise to be good in season 2,https://www.theverge.com/22590155/ted-lasso-apple-tv-plus-season-2-review
Ash Parrish,https://www.theverge.com/authors/ash-parrish,"Game developers aren’t so hot on NFTs, the metaverse, or huge acquisitions",https://www.theverge.com/23562296/gdc-2023-survey-microsoft-blizzard-activision-nft-unionization
Ash Parrish,https://www.theverge.com/authors/ash-parrish,The hardest part of Dragon Age: The Veilguard is making a choice,https://www.theverge.com/24307786/dragon-age-the-veilguard-full-review
Charles Pulliam-Moore,https://www.theverge.com/authors/charles-pulliam-moore,Dune: Part Two is a pointed examination of the books’ most subversive ideas,https://www.theverge.com/24086957/dune-part-two-movie-review
Elizabeth Lopatto,https://www.theverge.com/authors/elizabeth-lopatto,"Indie, rocked",https://www.theverge.com/24070565/pitchfork-gq-conde-nast-music-industry-change
Verge Staff,https://www.theverge.com/authors/verge-staff,The fight for net neutrality is forever,https://www.theverge.com/23727238/net-neutrality-history-fcc-legislation
Verge Staff,https://www.theverge.com/authors/verge-staff,DeepSeek: all the news about the startup that’s shaking up AI stocks,https://www.theverge.com/24353060/deepseek-ai-china-nvidia-openai
Nilay Patel,https://www.theverge.com/authors/nilay-patel,"AI will make money sooner than you’d think, says Cohere CEO Aidan Gomez",https://www.theverge.com/24173858/ai-cohere-aidan-gomez-money-revenue-llm-transformers-enterprise-stochastic-parrot
Andrew Webster,https://www.theverge.com/authors/andrew-webster,Final Fantasy VII Rebirth is a modern open-world RPG with the soul of 1997,https://www.theverge.com/24079544/final-fantasy-7-rebirth-review-ps5
Andrew Webster,https://www.theverge.com/authors/andrew-webster,Life by You is trying to shake up life sims with a greater sense of freedom,https://www.theverge.com/23658650/life-by-you-interview-rod-humble-sims-gdc-2023
Andrew Webster,https://www.theverge.com/authors/andrew-webster,Netflix unveils a terrifying AI in the first teaser for Jung_E,https://www.theverge.com/23520926/jung-e-netflix-teaser-trailer-release-date
Mia Sato,https://www.theverge.com/authors/mia-sato,The fever dream of TikTok Live election results,https://www.theverge.com/24288837/tiktok-live-presidential-election-results-electoral-map-votes
Adi Robertson,https://www.theverge.com/authors/adi-robertson,The pragmatist’s guide to the 2024 presidential election,https://www.theverge.com/24279103/2024-election-guide-trump-harris-policy-issues
Verge Staff,https://www.theverge.com/authors/verge-staff,The Verge’s 2023 in review,https://www.theverge.com/23998898/2023-best-worst-streaming-gaming-tech-roundup
James Vincent,https://www.theverge.com/authors/james-vincent,The future of AI is a conversation with a computer,https://www.theverge.com/22734662/ai-language-artificial-intelligence-future-models-gpt-3-limitations-bias
Shannon Liao,https://www.theverge.com/authors/shannon-liao,How Wordle lives on at The New York Times,https://www.theverge.com/23660809/wordle-new-york-times-interview-zoe-bell-gdc-2023
Andrew Webster,https://www.theverge.com/authors/andrew-webster,Famicom Detective Club brings more great crime drama to the Switch,https://www.theverge.com/22435952/famicom-detective-club-review-nintendo-switch
Nilay Patel,https://www.theverge.com/authors/nilay-patel,Why Adobe CEO Shantanu Narayen is confident we’ll all adapt to AI,https://www.theverge.com/24153956/adobe-shantanu-narayen-ai-firefly-premiere-photoshop-pdf-creativity-commerce
Nilay Patel,https://www.theverge.com/authors/nilay-patel,Google Zero is here — now what?,https://www.theverge.com/24167865/google-zero-search-crash-housefresh-ai-overviews-traffic-data-audience
Ash Parrish,https://www.theverge.com/authors/ash-parrish,Zelda: Echoes of Wisdom doesn’t test your intelligence enough,https://www.theverge.com/24253919/the-legend-of-zelda-echoes-of-wisdom-review-nintendo-switch
Joshua Rivera,https://www.theverge.com/authors/joshua-rivera,Terminator 3: Rise of the Machines marched us all to our doom,https://www.theverge.com/21405400/terminator-3-rise-of-the-machines-yesterdays-future
Sarah Jeong,https://www.theverge.com/authors/sarah-jeong,A demure and mindful trademark investigation,https://www.theverge.com/24230813/demure-mindful-trademark-uspto-explainer-jools-lebron
Lauren Feiner,https://www.theverge.com/authors/lauren-feiner,"J.D. Vance is anti-Big Tech, pro-crypto",https://www.theverge.com/24199314/jd-vance-donald-trump-vp-antitrust-big-tech-ftc-lina-khan-elizabeth-warren-google
Chaim Gartenberg,https://www.theverge.com/authors/chaim-gartenberg,Dune puts an epic franchise ahead of its epic story,https://www.theverge.com/22737214/dune-review-hbo-max-denis-villeneuve-timothee-chalamet-sandworm
Elizabeth Lopatto,https://www.theverge.com/authors/elizabeth-lopatto,Andreessen Horowitz saw the future — but did the future leave it behind?,https://www.theverge.com/23697708/andreessen-horowitz-a16z-investing-tech
Andrew Webster,https://www.theverge.com/authors/andrew-webster,The Great Ace Attorney Chronicles is the perfect vacation game,https://www.theverge.com/22597736/the-great-ace-attorney-chronicles-review-switch-ps4-steam
Russell Brandom,https://www.theverge.com/authors/russell-brandom,The human cost of Trump’s guest worker ban,https://www.theverge.com/21306188/guest-worker-ban-trump-h1b-visa-immigration-stamp-entry
Victoria Song,https://www.theverge.com/authors/victoria-song,The Evie Ring is cleverly designed but has some first-gen quirks,https://www.theverge.com/24105920/evie-ring-review-smart-ring-wearables
Kevin Nguyen,https://www.theverge.com/authors/kevin-nguyen,The year in arthouse movies,https://www.theverge.com/23994888/best-arthouse-movies-2023
James Vincent,https://www.theverge.com/authors/james-vincent,"Introducing the AI Mirror Test, which very smart people keep failing",https://www.theverge.com/23604075/ai-chatbots-bing-chatgpt-intelligent-sentient-mirror-test
Andrew Webster,https://www.theverge.com/authors/andrew-webster,Dune: Part Two’s first trailer is a tense sandworm ride,https://www.theverge.com/23698109/dune-part-2-trailer-sandworm-ride
Victoria Song,https://www.theverge.com/authors/victoria-song,2023 in smartwatches: the Googlefication of Fitbit,https://www.theverge.com/23972335/smartwatches-2023-fitbit-google-integration
Nilay Patel,https://www.theverge.com/authors/nilay-patel,Guest host Hank Green makes Nilay Patel explain why websites have a future,https://www.theverge.com/24087834/hank-green-decoder-podcast-google-youtube-web-media-platforms-distribution-future
Tom Warren,https://www.theverge.com/authors/tom-warren,These are Microsoft’s Bing AI secret rules and why it says it’s named Sydney,https://www.theverge.com/23599441/microsoft-bing-ai-sydney-secret-rules
Andrew Webster,https://www.theverge.com/authors/andrew-webster,"I know what Disney Plus with Hulu will look like, because I live in Canada",https://www.theverge.com/23962525/disney-plus-hulu-star-bundle
Chris Welch,https://www.theverge.com/authors/chris-welch,"2023 was business as usual in the headphone world, but next year should bring some shake-ups",https://www.theverge.com/23999795/earbuds-headphones-2024-preview-apple-samsung-sonos
Elizabeth Lopatto,https://www.theverge.com/authors/elizabeth-lopatto,"In 2020, the Trump administration declared war on dancing teens",https://www.theverge.com/22174704/2020-tiktok-ban-trump-administration
Emma Roth,https://www.theverge.com/authors/emma-roth,10 great shows from 2023 to watch on Hulu,https://www.theverge.com/23965702/hulu-best-shows-2023-streaming
Charles Pulliam-Moore,https://www.theverge.com/authors/charles-pulliam-moore,8 fantastic shows from 2023 to stream on Netflix,https://www.theverge.com/23979537/netflix-best-shows-2023
Alex Cranz,https://www.theverge.com/authors/alex-cranz,The best shows on Paramount Plus in 2023,https://www.theverge.com/23999770/paramount-plus-best-shows-2023
Elizabeth Lopatto,https://www.theverge.com/authors/elizabeth-lopatto,The tech industry moved fast and broke its most prestigious bank,https://www.theverge.com/23635692/silicon-valley-bank-svb-collapse-explainer-startups-venture-capital
Elizabeth Lopatto,https://www.theverge.com/authors/elizabeth-lopatto,Less money and more fear: what’s going on with tech,https://www.theverge.com/23598517/interest-rates-tech-vc-sea-change
Robyn Kanner,https://www.theverge.com/authors/robyn-kanner,Hirokazu Kore-eda is so back,https://www.theverge.com/23992731/hirokazu-kore-eda-monster-interview
Elizabeth Lopatto,https://www.theverge.com/authors/elizabeth-lopatto,Adam Neumann’s WeWork debacle wasn’t possible without VC help,https://www.theverge.com/22585805/adam-neumann-cult-of-we-wework-book-vc
Nilay Patel,https://www.theverge.com/authors/nilay-patel,Chris Dixon thinks web3 is the future of the internet — is it?,https://www.theverge.com/23020727/decoder-chris-dixon-web3-crypto-a16z-vc-silicon-valley-investing-podcast-interview
Amrita Khalid,https://www.theverge.com/authors/amrita-khalid,Podcasts are in the middle of a numbers and people crisis,https://www.theverge.com/24002021/podcasts-2023-layoffs-analytics
Barbara Krasnoff,https://www.theverge.com/authors/barbara-krasnoff,The Verge’s favorite books from 2023,https://www.theverge.com/23971310/verge-2023-favorite-books
Andrew Webster,https://www.theverge.com/authors/andrew-webster,8 great series and movies to stream on Disney Plus,https://www.theverge.com/23979424/disney-plus-best-shows-movies-streaming-2023
Chris Welch,https://www.theverge.com/authors/chris-welch,Sennheiser IE 200 earbuds review: reconnecting with music — literally,https://www.theverge.com/23594458/sennheiser-ie-200-wired-earbuds-iem-review-features
Emma Roth,https://www.theverge.com/authors/emma-roth,10 great shows from 2023 to stream on Amazon Prime Video,https://www.theverge.com/23952477/amazon-prime-video-best-shows-2023
Andrew Webster,https://www.theverge.com/authors/andrew-webster,"Hulu’s No One Will Save You is taut, minimalist sci-fi horror",https://www.theverge.com/23883971/no-one-will-save-you-review-hulu
Jay Peters,https://www.theverge.com/authors/jay-peters,8 great games for your Switch from 2023,https://www.theverge.com/23978273/nintendo-switch-best-games-2023
Russell Brandom,https://www.theverge.com/authors/russell-brandom,Fear of a Chinese social network,https://www.theverge.com/21322612/tiktok-security-china-bytedance-spying-app-privacy
Antonio G. Di Benedetto,https://www.theverge.com/authors/antonio-g-di-benedetto,Sony’s PlayStation Portal gives a confusing first impression,https://www.theverge.com/23958572/sony-playstation-portal-ps5-streaming-remote-play-handheld-specs-impressions
Jon Porter,https://www.theverge.com/authors/jon-porter,10 great Windows PC games from 2023,https://www.theverge.com/23979457/best-windows-pc-games-2023
Nilay Patel,https://www.theverge.com/authors/nilay-patel,Steve Aoki on why he’s a ‘crypto believer’,https://www.theverge.com/22999333/decoder-steve-aoki-crypto-web3-aokiverse-metaverse-music-industry-business-nft
Charles Pulliam-Moore,https://www.theverge.com/authors/charles-pulliam-moore,Our 12 favorite movies from TIFF 2023,https://www.theverge.com/23879088/tiff-2023-best-movies-dream-scenario-smugglers
Andrew Webster,https://www.theverge.com/authors/andrew-webster,Netflix’s Scott Pilgrim Takes Off isn’t an adaptation — it’s a remix,https://www.theverge.com/23963700/scott-pilgrim-takes-off-review-netflix
Justine Calma,https://www.theverge.com/authors/justine-calma,"Kamala Harris hasn’t said a lot about tech policy, but here’s what we know",https://www.theverge.com/24205360/kamala-harris-tech-policy-explainer-democratic-presidential-election
Verge Staff,https://www.theverge.com/authors/verge-staff,The tech bank collapse of 2023,https://www.theverge.com/23638474/svb-collapse-silvergate-silicon-valley-bank-tech-crypto
Andrew Webster,https://www.theverge.com/authors/andrew-webster,The careful balancing act of translating an Ace Attorney game,https://www.theverge.com/22594314/the-great-ace-attorney-nintendo-switch-translation-janet-hsu-interview
Sarah Jeong,https://www.theverge.com/authors/sarah-jeong,The US declared war on TikTok because it can’t handle the truth,https://www.theverge.com/21355465/tiktok-us-china-information-nationalism-online-propaganda
Jay Peters,https://www.theverge.com/authors/jay-peters,Vampire Survivors feels like a different game with a friend,https://www.theverge.com/23832998/vampire-survivors-co-op-nintendo-switch
Ash Parrish,https://www.theverge.com/authors/ash-parrish,The best PlayStation games from 2023,https://www.theverge.com/24008545/playstation-ps5-best-games-2023
Charles Pulliam-Moore,https://www.theverge.com/authors/charles-pulliam-moore,Avatar: The Way of Water is a gorgeous rehash of all the first film’s triumphs and failures,https://www.theverge.com/23506880/avatar-the-way-of-water-review
Adi Robertson,https://www.theverge.com/authors/adi-robertson,Seeing other people’s AI art is like hearing other people’s dreams,https://www.theverge.com/23501694/ai-art-chatgpt-dalle-image-text-generation-boring
Verge Staff,https://www.theverge.com/authors/verge-staff,The Verge’s 2024 holiday gift guide,https://www.theverge.com/24224043/holiday-gift-guide-2024-best-ideas-unique-tech-gadgets
Ash Parrish,https://www.theverge.com/authors/ash-parrish,Even Elden Ring’s game director knows Erdtree is too hard,https://www.theverge.com/24183692/hidetaka-miyazaki-interview-shadow-of-the-erdtree-difficulty
Ash Parrish,https://www.theverge.com/authors/ash-parrish,Dragon Age: The Veilguard starts slow but strong,https://www.theverge.com/24281631/dragon-age-the-veilguard-early-review-ps5-xbox-pc
Andrew Webster,https://www.theverge.com/authors/andrew-webster,Junji Ito has a terrifying new short story collection just in time for Halloween,https://www.theverge.com/23925649/junji-ito-mimis-tales-of-terror-review-horror-manga
Charles Pulliam-Moore,https://www.theverge.com/authors/charles-pulliam-moore,Good Omens season 2 is a lovey-dovey shipper’s delight,https://www.theverge.com/23807387/good-omens-season-2-review-amazon-prime-video
Charles Pulliam-Moore,https://www.theverge.com/authors/charles-pulliam-moore,"Amazon’s I’m a Virgo knows what it means to be too big, Black, and brilliant for this world",https://www.theverge.com/23754149/im-a-virgo-boots-riley-tv-show-amazon-review
Andrew Webster,https://www.theverge.com/authors/andrew-webster,Apple’s dark sci-fi comedy Fingernails turns love into science,https://www.theverge.com/23881997/fingernails-review-apple-tv-plus
Ash Parrish,https://www.theverge.com/authors/ash-parrish,Shadow of the Erdtree reintroduced me to Elden Ring by kicking my ass,https://www.theverge.com/24180536/shadow-of-the-erdtree-review-elden-ring-dlc
Lauren Feiner,https://www.theverge.com/authors/lauren-feiner,Republicans release tech executives’ internal communications,https://www.theverge.com/24146357/republicans-internal-emails-texts-tech-executives-meta-facebook-white-house
Andrew Webster,https://www.theverge.com/authors/andrew-webster,The Boy and the Heron’s first trailer is a glimpse at Miyazaki’s next dark fantasy,https://www.theverge.com/23859581/the-boy-and-the-heron-trailer-release-date
Verge Staff,https://www.theverge.com/authors/verge-staff,TikTok’s future in the US: all of the news about Microsoft’s deal and Trump’s ban threats,https://www.theverge.com/21354287/tiktok-us-trump-bytedance-future-ban-news-updates
Verge Staff,https://www.theverge.com/authors/verge-staff,The Halloween 2023 StoryScream: things to play and watch this spooky season,https://www.theverge.com/23911556/halloween-2023-games-movies-tv-streaming-recommendations
Justine Calma,https://www.theverge.com/authors/justine-calma,EPA administrator Michael Regan on undoing the toxic legacy of power plants in the US,https://www.theverge.com/24140189/epa-administrator-michael-regan-interview-power-plant-pollution-rules
Andrew Webster,https://www.theverge.com/authors/andrew-webster,Pearl is a slasher prequel that makes the original even better,https://www.theverge.com/23352979/pearl-review-tiff-2022
